pub_date,media_name,title,description,movie_id
2014-07-30 07:28:00,entertain,[인터뷰] ‘명량’ 최민식 “치고박다보면 갑옷이 걸레가 될 정도”,"기적이나 다름 없는 당시 전투는 ‘명량대첩’(1597년)으로 역사책에 기록됐고, 2014년 영화 ‘명량’으로 다시 태어났다. 최민식은 스크린 속 이순신의 위풍당당한 모습 그대로 인터뷰 장소에 나타났다. 희끗희끗한... ",myeongryang
2014-08-04 19:16:00,entertain,"영화계 평정한 난세의 영웅, 명량 천만 관객 향해 순항","영화 명량 흥행 추이/2014-08-04(한국스포츠) 이런 추세라면 1,000만 관객 돌파도 시간 문제로 보인다. 명량은 개봉한 지 엿새 만에 500만 관객을 동원했는데 한국 영화 최다 관객 기록(1,298만명)을 세운 도둑들(335만명)과... ",myeongryang
2014-08-06 21:47:00,newdaily,"명량, 세월호 그리고 이순신-박근혜 리더십 비교",- 영화 <명량> 中 다시 2014년. 세월호 참사에 나락에 떨어진 국민들은 치밀어 오르는 분노를 풀 곳이 없다. 자연스럽게 향하는 국정 최고통수권자에 대한 책임론. 하지만 사과는 쉽게 나오지 않았다. '유감' '안타깝다'는... ,myeongryang
2014-08-07 12:21:00,newdaily,[뉴데일리 주요 뉴스] 2014년 8월7일,- 영화 <명량> 中 다시 2014년. 세월호 참사에 나락에 떨어진 국민들은 치밀어 오르는 분노를 풀 곳이 없다. 자연스럽게 향하는 국정 최고통수권자에 대한 책임론. 하지만 사과는 쉽게 나오지 않았다. '유감' '안타깝다'는... ,myeongryang
2014-08-08 06:21:00,daejonilbo,"[데스크 광장] 명량, 악마 같은 사회를 꾸짖다","417년이 지난 2014년, 영화 명량의 배경인 진도 앞바다 팽목 맹골수로에 세월호가 침몰하고 304명이 억울하게 생매장된다. 이순신 장군의 리더십이 빛난 그곳에 후손들의 리더십은 침몰됐다. 국가기관의 위기관리 능력 부재... ",myeongryang
2014-08-08 11:46:00,lec,신희섭의 정치학-영화 '명량'을 보고나서,신희섭 정치학 박사 고려대학교 평화연구소 선임연구원 최근 가장 뜨거운 영화가 이순신 장군을 다룬 '명량'이다. 영화진흥위원회에 따르면 2014년 8월 6일 오후 2시에 관객 수가 700만을 넘어 섰다고 한다. 개봉 8일 만에... ,myeongryang
2014-08-10 14:30:00,네이버뉴스,"명량 1000만 관객 돌파, 개봉 12일만…한국 영화 사상 열 번째","'명량'은 1597년 임진왜란 6년, 우리나라 최고의 영웅으로 꼽히는 이순신 장군이 단 12척의 배로 330척에 달하는 왜군의 공격에 맞서 싸운 '명량대첩'을 담은 영화다. 2014 여성신문의 약속 '여성이 평화다' ⓒ 대한민국... ",myeongryang
2014-08-11 09:15:00,entertain,"'명량', '아바타' 넘을까…역대 최고 흥행작 도전","이로써 '명량'은 '겨울왕국'이 세운 1,029만 5,591명의 관객 기록을 넘어 2014년 최고 흥행 영화가 됐다. '명량'은 개봉 2주차 주말에도 280만 명이 넘는 관객을 끌어모아 변함없는 흥행세를 자랑하고 있다. 역대 최고... ",myeongryang
2014-08-11 12:20:00,entertain,명량 누적관객 천만 넘어 '아바타' 기록에 도전한다... 관심,"이로써 '명량'은 '겨울왕국'이 세운 1,029만 5,591명의 관객 기록을 넘어 2014년 최고 흥행 영화가 됐다. '명량'은 개봉 2주차 주말에도 280만 명이 넘는 관객을 끌어모아 변함없는 흥행세를 자랑하고 있다. 역대 최고... ",myeongryang
2014-08-11 16:54:00,newsinside,"명량, 425,000명의 팔로워를 가진 진중권 교수의 트위터에는...","2014/8/6 영화 '명량'은 솔직히 졸작이죠. 흥행은 영화의 인기라기보다 이순신 장군의 인기로 해석해야 할 듯.... '활'은 참 괜찮았는데. 2014/8/1 비평 역시 신랄할 수도 있지만, 비평의 기본원칙은 (1) 일단 상대의... ",myeongryang
2014-08-12 16:33:00,entertain,'이순신' 등장하면 흥행한다?...역대 이순신 영화 되돌아보기,[사진=영화 '명량'(2014) 포스터] 이처럼 충무공 이순신을 다룬 영화들은 전기적인 내용을 진지하게 다루거나 화려한 전쟁신을 내세운 액션 영화로 만들어왔다. 이를 통해 작품성을 앞세우거나 대중성 있는 오락영화를... ,myeongryang
2014-08-13 15:26:00,entertain,"진중권 “육갑” vs 허지웅 “멀리 간 듯”, 2014판 명량대첩 발발","‘허지웅 진중권 설전’ 진중권 “육갑” vs 허지웅 “멀리 간 듯”, 2014판 명량대첩 발발 영화평론가 겸 방송인 허지웅과 동양대학교 교수이자 평론가 진중권이 영화 ‘명량’을 놓고 SNS 설전을 벌여 이목을 끌고 있다.... ",myeongryang
2014-08-16 21:15:00,네이버뉴스,"영화 ‘명량’, 1300만 돌파하며 한국 영화 신기록","영화 명량은 1597년 임진왜란 6년, 12척의 배로 왜척 330척과 싸워 이긴 명량대첩을 다룬 영화다. 2014 여성신문의 약속 '여성이 평화다' ⓒ 대한민국 여성의 대변지 여성신문 - 상업적 무단전재 & 재배포 금지... ",myeongryang
2014-08-18 09:47:00,entertain,"흥행영화에 꼭 있다, '외모+연기'되는 신예",◇ 2014 한국 영화 흥행 신기록 '명량' 권율 연일 스코어를 경신하며 1500만 관객을 돌파하는 영화 '명량'(김한민 감독)에도 수려한 외모와 그를 뛰어넘는 깊은 연기까지 겸비한 신예 배우가 있다. 장군의 아들로 관객들에게... ,myeongryang
2014-08-20 15:03:00,choicenews,"G3·클라우드·설빙·명량, '2014 올해의 브랜드 대상' 특별상 선정",그 결과 △LG G3 △클라우드 △설빙 △비락식혜 △아이오페 에어쿠션 △영단기 △꼬마버스 타요 △인스타그램 △서울시장 박원순 △배우 김보성 △개그우먼 이국주 △영화 명량이 2014 올해의 브랜드 대상 특별상... ,myeongryang
2019-05-29 16:28:00,entertain,"[SC초점]""천만 예측?""…'기생충' 개봉 D-1, 칸의 영광 흥행으로 이어질까","칸에서 이미 증명됐지만 '기생충'이 2019년 한국 영화 최고의 기대작이라는 데는 이견이 없다. '플란다스의 개'(2000년), '살인의 추억'(2003년), '괴물'(2006년), '마더'(2009년), '설국열차'(2013년), '옥자'(2017년)를 연출한 거장... ",parasite
2019-05-30 03:36:00,topstarnews,"몬스터버스 3번째 영화 '고질라: 킹 오브 몬스터', 개봉 첫 날 박스오피...",2위에 오른 '악인전'은 308만 관객을 돌파했다. 30일 개봉하는 2019년 한국영화 사상 최고 기대작 '기생충'은 30일 오전 3시 32분 기준 78.3%의 엄청난 실시간 예매율로 1위를 달리고 있다. [톱스타뉴스=],parasite
2019-05-30 07:10:00,sisaon,"[김기범의 뷰파인더] 영화 ＜기생충＞, '제2의 김기영'이 만들어낸 현대...",자타가 공인하는 '제2의 김기영' 봉준호 감독의 일곱 번째 장편영화 <기생충>은 2019년을 사는 오늘의 우리를 신랄하게 비틀지는 않는다. 다만 있는 그대로 평범한 백수 가족의 생존 투쟁기를 약간의 과장과 씁쓸한 웃음... ,parasite
2019-05-30 09:50:00,entertain,"[SC초점]""예매율 77%""…'기생충' D-day, 칸의 영광 흥행으로 이어질까","'기생충'은 2019년 한국 영화 최고의 기대작이다. '플란다스의 개'(2000년), '살인의 추억'(2003년), '괴물'(2006년), '마더'(2009년), '설국열차'(2013년), '옥자'(2017년)를 연출한 거장 봉준호 감독의 신작으로 제작단계부터... ",parasite
2019-05-30 20:10:00,네이버뉴스,"칸 영화제 주요 수상작 기생충, 박쥐, 밀양, 올드보이 관객 수는?","칸 영화제 황금종려상: 기생충(2019), 봉준호 감독-? 주목할 부분은 올드보이와 박쥐의 경우 청소년관람불가(고등학교 재학생 포함 만 18세 미만 관람 불가) 영화로 영화 관람 등급 가운데 관객몰이에 가장 불리한... ",parasite
2019-05-31 06:18:00,stoo,"'기생충' 개봉 첫날 무려 56만 관객 동원, 압도적 관람 욕구 분출",봉준호 감독의 7번째 연출작인 '기생충'은 2019 칸영화제에서 한국 영화 최초로 황금종려상을 수상하며 관객들의 기대가 폭주한 작품이다. '기생충'은 전원백수인 기택네 장남 기우가 고액 과외 면접을 위해 박사장네... ,parasite
2019-06-03 11:05:00,nbntv,"""봉 감독이 말하고 싶었던 것?"" 영화 '기생충' 줄거리 및 해석 풀이는?…...","▲(영화 기생충 줄거리, 해석, 스포, 무대인사, 관객수 등=ⓒ영화진흥위원회) 영화 '기생충'의 2019년 칸 영화제 '황금 종려상' 수상은 대한민국 최초의 일이자 국내 영화 역사 100주년을 기념할만한 경사였다. 국외에서의... ",parasite
2019-06-04 08:26:00,stoo,"'기생충' 관객수 374만 돌파, 압도적 1위",봉준호 감독의 7번째 연출작인 '기생충'은 2019 칸영화제에서 한국 영화 최초로 황금종려상을 수상하며 관객들의 기대가 폭주한 작품이다. '기생충'은 전원백수인 기택네 장남 기우가 고액 과외 면접을 위해 박사장네... ,parasite
2019-06-04 14:02:00,movist,조용하게 돈 벌어 훌륭한 예술 소비하는 노동자 <오버데어> <기생충> 정...,최우식 씨가 본인이 노래를 잘한다고 했다더라.(웃음) 노래를 시킬 줄은 꿈에도 모르고 그랬다고 하더라.(웃음) <오버 데어>와 <기생충> 영화음악을 선보이며 2019년 상반기를 보냈다. 앞으로의 계획은 어떤가. 작곡가는 어떤... ,parasite
2019-06-05 09:34:00,stoo,"'기생충' 누적 관객수 400만 명 돌파, '알라딘' 2위",봉준호 감독의 7번째 연출작인 '기생충'은 2019 칸영화제에서 한국 영화 최초로 황금종려상을 수상하며 관객들의 기대가 폭주한 작품이다. '기생충'은 전원백수인 기택네 장남 기우가 고액 과외 면접을 위해 박사장네... ,parasite
2019-06-07 08:52:00,stoo,'기생충' 현충일 무려 83만 명 동원…누적 관객수 535만 '흥행 폭주',봉준호 감독의 7번째 연출작인 '기생충'은 2019 칸영화제에서 한국 영화 최초로 황금종려상을 수상하며 관객들의 기대가 폭주한 작품이다. '기생충'은 전원백수인 기택네 장남 기우가 고액 과외 면접을 위해 박사장네... ,parasite
2019-06-07 15:18:00,theceluv,"[스타 직격톡] “NICE"" ‘기생충’ 배우들이 생각하는 봉준호 감독","영화 ‘기생충’이 2019 칸 영화제에서 황금종려상을 수상하면서 봉준호 감독은 한국과 전 세계가 주목하는 인물이 됐다. 전 세계적인 보편타당한 정서로서 계층 차이, 계층 갈등을 현실감 있게 그려낸 이 영화는 봉준호... ",parasite
2019-06-13 11:24:00,nongaek,4차 산업혁명과 기생충,"영화 기생충(봉준호, 2019)은 제72회 칸 영화제에서 대상격인 '황금종려상'을 받았다. 100주년을 맞은 한국영화의 위대함에 심사위원들은 만장일치로 박수를 보냈다. 나 또한 박수를 보태기 위해 얼마 전 영화관에서... ",parasite
2019-06-18 11:06:00,mhns,"[MHN STAR] 영화 '마녀', '기생충'의 배우 '최우식' 필모그래피, 국적, 영...","이후 독립영화 '거인(2014)', 좀비·스릴러 영화 '부산행(2016)', 미스터리·액션 영화 '마녀(2018)', 블랙코미디 영화 '기생충(2019)'까지 장르에 상관없이 다양한 작품에 출연했다. 이렇듯 한국에서 장기간 활동하고... ",parasite
2019-06-26 11:14:00,조선일보,[직업의 세계] 번역가 - 〈기생충〉 번역가 달시 파켓 | “영화 속 캐릭...,"영어 자막 상영관이 늘어나면 좋겠습니다.” 번역가 | 원저작물의 숨결까지 옮겨 담는 제2의 창작자 2016년 한강 작가의 소설 《채식주의자》 맨부커상 수상, 2019년 봉준호 감독의 영화 〈기생충〉 칸영화제 황금종려상... ",parasite
2015-09-03 07:48:00,entertain,"韓영화 아카데미 외국어영화상 도전사, '사도' 24번째 출품","2015년에는 심성보 감독의 '해무'가 한국 대표작으로 출품됐다. 이준익 감독으로서는 2007년 '왕의 남자' 이후 2번째 도전이다. 한국 출품작이 단 한 번도 후보에 오르지 못한 외국어영화상이지만, 내년의 '사도'는... ",sado
2015-09-03 10:59:00,starseoultv,"[별별★영화] '함정', 마동석·조한선 깜짝 무대인사/'암살', 역대 한국...","올해 한국영화 첫 천만 기록을 세운 것에 이어, '어벤져스: 에이지 오브 울트론'을 제치고 2015년 최고 흥행... 그려낸 영화 '사도(감독 이준익)'에서 배우 소지섭이 '사도'의 아들 '정조'로 특별 출연해 관객들의 시선을... ",sado
2015-09-03 11:03:00,entertain,"'사도', 아카데미 출품 이유는?..""외국인도 공감 가능""",2015년 하반기 기대작으로 손꼽히는 '사도'는 2016년 2월 28일 개최되는 제88회 미국 아카데미영화상 외국어 영화부문 한국 출품작으로 선정되었다. 1929년부터 시작된 미국 최대의 영화상인 아카데미영화상에서 '사도'가... ,sado
2015-09-03 11:41:00,entertain,"‘사도’, 제88회 아카데미영화상 외국어 영화부문 한국영화 출품작 선...",2015년 하반기 최고의 기대작으로 손꼽히는 ‘사도’가 2016년 2월 28일 개최되는 제88회 미국 아카데미영화상 외국어 영화부문 한국 출품작으로 선정되었다. 1929년부터 시작된 미국 최대의 영화상인 아카데미영화상에서... ,sado
2015-09-03 12:44:00,obsnews,"이준익 감독 '사도', 제88회 아카데미 영화상 韓영화 출품작 선정",한국영화 출품작으로 선정됐다. 2015년 하반기 최고의 기대작으로 손꼽히는 '사도'가 2016년 2월 28일 개최되는 제88회 미국 아카데미영화상 외국어 영화부문 한국 출품작으로 선정돼 눈길을 끌고 있다. 지난 1929년부터... ,sado
2015-09-03 13:41:00,네이버뉴스,"‘사도’, 제88회 아카데미영화상 외국어 영화부문 韓대표 출품작 선정",2015년 하반기 최고의 기대작으로 손꼽히는 영화 ‘사도’가 오는 2016년 2월28일 개최되는 제88회 미국 아카데미영화상 외국어 영화부문 한국 출품작으로 선정됐다. 지난 1929년부터 시작된 미국 최대의 영화상인... ,sado
2015-09-03 16:42:00,entertain,[리폿@이슈] 첫공개 '사도' 강렬…송강호의 통곡과 유아인의 광기,피로 물든 뒤주에 갇힌 부정 3일 오후 서울 강남구 삼성동 메가박스 코엑스점에서 영화 '사도'(이준익 감독... 2015년 충무로에서 나올 수 있는 최고의 사극이다. 감정과 감동이 요동친다. 이준익 감독은 영조(송강호)와 사도... ,sado
2015-09-03 16:54:00,뉴스엔,‘사도’ 88회 美 아카데미영화상 외국어영화부문 출품,2015년 하반기 최고의 기대작으로 손꼽히는 '사도'가 2016년 2월 28일 개최되는 제88회 미국 아카데미영화상 외국어 영화부문 한국 출품작으로 선정됐다. 1929년부터 시작된 미국 최대의 영화상인 아카데미영화상에서 '사도... ,sado
2015-09-03 17:50:00,entertain,"[SS화보]영화 '사도' 문근영, 극과는 완전히 다른 모습으로!","한편, 영화 ‘사도’는 조선시대 영조와 사도세자의 비극적인 가족사를 다룬 영화로 이준익 감독이 연출을 맡았으며 송강호, 유아인, 문근영, 김혜숙, 전혜진 등이 출연한다. 2015. 9. 3. upandup@sportsseoul.com... ",sado
2015-09-03 17:52:00,entertain,"[SS포토]영화 '사도' 문근영, 각선미 드러나는 앞트임 드레스","영화 ‘사도’는 조선시대 영조와 사도세자의 비극적인 가족사를 다룬 영화로 이준익 감독이 연출을 맡았으며 송강호, 유아인, 문근영, 김혜숙, 전혜진 등이 출연한다. 2015. 9. 3. upandup@sportsseoul.com... ",sado
2015-09-03 17:53:00,entertain,"[SS포토]영화 '사도' 문근영, '꼭 해보고 싶었던 역할!'","영화 ‘사도’는 조선시대 영조와 사도세자의 비극적인 가족사를 다룬 영화로 이준익 감독이 연출을 맡았으며 송강호, 유아인, 문근영, 김혜숙, 전혜진 등이 출연한다. 2015. 9. 3. upandup@sportsseoul.com... ",sado
2015-09-03 17:54:00,entertain,"[SS포토]영화 '사도' 문근영, 극과는 다른 시원스런 옷차림","영화 ‘사도’는 조선시대 영조와 사도세자의 비극적인 가족사를 다룬 영화로 이준익 감독이 연출을 맡았으며 송강호, 유아인, 문근영, 김혜숙, 전혜진 등이 출연한다. 2015. 9. 3. upandup@sportsseoul.com... ",sado
2015-09-03 17:54:00,entertain,[SS포토]우아한 모습으로 무대에 오르는 문근영(영화 '사도'),"영화 ‘사도’는 조선시대 영조와 사도세자의 비극적인 가족사를 다룬 영화로 이준익 감독이 연출을 맡았으며 송강호, 유아인, 문근영, 김혜숙, 전혜진 등이 출연한다. 2015. 9. 3. upandup@sportsseoul.com... ",sado
2015-09-03 17:55:00,entertain,"[SS포토]영화 '사도' 문근영, '자리 잡기 힘드네!'","영화 ‘사도’는 조선시대 영조와 사도세자의 비극적인 가족사를 다룬 영화로 이준익 감독이 연출을 맡았으며 송강호, 유아인, 문근영, 김혜숙, 전혜진 등이 출연한다. 2015. 9. 3. upandup@sportsseoul.com... ",sado
2015-09-03 17:55:00,entertain,"[SS포토]영화 '사도' 시사회, 질문에 답하는 문근영","영화 ‘사도’는 조선시대 영조와 사도세자의 비극적인 가족사를 다룬 영화로 이준익 감독이 연출을 맡았으며 송강호, 유아인, 문근영, 김혜숙, 전혜진 등이 출연한다. 2015. 9. 3. upandup@sportsseoul.com... ",sado
2015-09-03 17:56:00,newsculture,‘사도’ 이준익 감독 “1000만 영화 욕심 버렸는데 유아인 때문에 흔들...,"[영화정보] 영화명: ‘사도’ 장르: 사극 감독: 이준익 개봉일: 2015년 9월 16일출연: 송강호, 유아인, 문근영, 김해숙, 전혜진 외. 관람등급: 12세이상 관람가 (뉴스컬처=김이슬 기자) 대한민국 No.1 문화신문 [뉴스컬처]... ",sado
2015-09-03 17:56:00,entertain,"[SS포토]영화 '사도' 문근영, '시작부터 갈증이 나요!'","영화 ‘사도’는 조선시대 영조와 사도세자의 비극적인 가족사를 다룬 영화로 이준익 감독이 연출을 맡았으며 송강호, 유아인, 문근영, 김혜숙, 전혜진 등이 출연한다. 2015. 9. 3. upandup@sportsseoul.com... ",sado
2015-09-03 17:57:00,entertain,"[SS포토]영화 '사도' 문근영, '계단이 두려워요!'","영화 ‘사도’는 조선시대 영조와 사도세자의 비극적인 가족사를 다룬 영화로 이준익 감독이 연출을 맡았으며 송강호, 유아인, 문근영, 김혜숙, 전혜진 등이 출연한다. 2015. 9. 3. upandup@sportsseoul.com... ",sado
2015-09-03 17:58:00,entertain,"[SS포토]영화 '사도' 문근영, '극중 모습과는 많이 다르죠?'","영화 ‘사도’는 조선시대 영조와 사도세자의 비극적인 가족사를 다룬 영화로 이준익 감독이 연출을 맡았으며 송강호, 유아인, 문근영, 김혜숙, 전혜진 등이 출연한다. 2015. 9. 3. upandup@sportsseoul.com... ",sado
2015-09-03 17:58:00,entertain,"[SS포토]영화 '사도'의 유아인, '베테랑의 인기를 이어서!'","영화 ‘사도’는 조선시대 영조와 사도세자의 비극적인 가족사를 다룬 영화로 이준익 감독이 연출을 맡았으며 송강호, 유아인, 문근영, 김혜숙, 전혜진 등이 출연한다. 2015. 9. 3. upandup@sportsseoul.com... ",sado
2015-09-03 17:59:00,entertain,"[SS포토]영화 '사도'의 유아인, '육체적인 것보다 정신적 연기가 더 힘들...","영화 ‘사도’는 시대 영조와 사도세자의 비극적인 가족사를 다룬 영화로 이준익 감독이 연출을 맡았으며 송강호, 유아인, 문근영, 김혜숙, 전혜진 등이 출연한다. 2015. 9. 3. upandup@sportsseoul.com... ",sado
2015-09-03 18:01:00,newsculture,"2년 만에 스크린 돌아온 송강호, 영화 ‘사도’ 선택한 이유는?","[영화정보] 영화명: ‘사도’ 장르: 사극 감독: 이준익 개봉일: 2015년 9월 16일출연: 송강호, 유아인, 문근영, 김해숙, 전혜진 외. 관람등급: 12세이상 관람가 (뉴스컬처=김이슬 기자) 대한민국 No.1 문화신문 [뉴스컬처]... ",sado
2015-09-03 18:27:00,newsculture,‘사도’ 문근영 “드라마 ‘명성황후’ 때부터 혜경궁 홍씨役 욕심났다...,"[영화정보] 영화명: ‘사도’ 장르: 사극 감독: 이준익 개봉일: 2015년 9월 16일출연: 송강호, 유아인, 문근영, 김해숙, 전혜진 외. 관람등급: 12세이상 관람가 (뉴스컬처=김이슬 기자) 대한민국 No.1 문화신문 [뉴스컬처]... ",sado
2015-09-03 18:29:00,newsculture,‘사도’ 유아인 “송강호 선배 앞에서 연기에 대해 논하기 민망하다”,"[영화정보] 영화명: ‘사도’ 장르: 사극 감독: 이준익 개봉일: 2015년 9월 16일출연: 송강호, 유아인, 문근영, 김해숙, 전혜진 외. 관람등급: 12세이상 관람가 (뉴스컬처=김이슬 기자) 대한민국 No.1 문화신문 [뉴스컬처]... ",sado
2015-09-03 20:18:00,entertain,[SS포토]2년만에 영화 '사도'로 스크린 복귀한 송강호,"영화 ‘사도’는 시대 영조와 사도세자의 비극적인 가족사를 다룬 영화로 이준익 감독이 연출을 맡았으며 송강호, 유아인, 문근영, 김혜숙, 전혜진 등이 출연한다. 2015. 9. 3. upandup@sportsseoul.com... ",sado
2015-09-03 20:22:00,entertain,[SS포토]영화 '사도' 언론시사회 및 기자 간담회,"영화 ‘사도’는 조선시대 영조와 사도세자의 비극적인 가족사를 다룬 영화로 이준익 감독이 연출을 맡았으며 송강호, 유아인, 문근영, 김혜숙, 전혜진 등이 출연한다. 2015. 9. 3. upandup@sportsseoul.com... ",sado
2015-09-03 20:32:00,entertain,"[SS포토]영화 '사도' 기자간담회, 유아인 머리 가리키는 문근영","영화 ‘사도’는 조선시대 영조와 사도세자의 비극적인 가족사를 다룬 영화로 이준익 감독이 연출을 맡았으며 송강호, 유아인, 문근영, 김혜숙, 전혜진 등이 출연한다. 2015. 9. 3. upandup@sportsseoul.com... ",sado
2015-09-03 20:33:00,newsculture,"‘사도’ 문근영, 감출 수 없는 ‘미소’(NC포토)","[영화정보]영화명: ‘사도’장르: 사극감독: 이준익개봉일: 2015년 9월 16일출연: 송강호, 유아인, 문근영, 김해숙, 전혜진 외.관람등급: 12세이상 관람가 (뉴스컬처=) 대한민국 No.1 문화신문 [뉴스컬처] [네이버 뉴스스탠드]... ",sado
2015-09-03 20:33:00,newsculture,"‘사도’ 송강호, 작품을 빛내는 왕의 위엄(NC포토)","[영화정보]영화명: ‘사도’장르: 사극감독: 이준익개봉일: 2015년 9월 16일출연: 송강호, 유아인, 문근영, 김해숙, 전혜진 외.관람등급: 12세이상 관람가 (뉴스컬처=) 대한민국 No.1 문화신문 [뉴스컬처] [네이버 뉴스스탠드]... ",sado
2015-09-03 20:33:00,newsculture,"‘사도’ 전혜진, 누구보다 화려하게… 자신감 넘치는 포즈(NC포토)","[영화정보]영화명: ‘사도’장르: 사극감독: 이준익개봉일: 2015년 9월 16일출연: 송강호, 유아인, 문근영, 김해숙, 전혜진 외.관람등급: 12세이상 관람가 (뉴스컬처=) 대한민국 No.1 문화신문 [뉴스컬처] [네이버 뉴스스탠드]... ",sado
2015-09-03 20:33:00,newsculture,"‘사도’ 문근영, 블랙 드레스 입고 우아하게(NC포토)","[영화정보]영화명: ‘사도’장르: 사극감독: 이준익개봉일: 2015년 9월 16일출연: 송강호, 유아인, 문근영, 김해숙, 전혜진 외.관람등급: 12세이상 관람가 (뉴스컬처=) 대한민국 No.1 문화신문 [뉴스컬처] [네이버 뉴스스탠드]... ",sado
2015-09-03 20:33:00,newsculture,"‘사도’ 김해숙, 쉽게 소화할 수 없는 화이트패션 뽐내며(NC포토)","[영화정보]영화명: ‘사도’장르: 사극감독: 이준익개봉일: 2015년 9월 16일출연: 송강호, 유아인, 문근영, 김해숙, 전혜진 외.관람등급: 12세이상 관람가 (뉴스컬처=) 대한민국 No.1 문화신문 [뉴스컬처] [네이버 뉴스스탠드]... ",sado
2015-09-03 20:33:00,newsculture,‘사도’에는 ‘암살’도 ‘베테랑’도 다 있답니다(NC포토),"[영화정보]영화명: ‘사도’장르: 사극감독: 이준익개봉일: 2015년 9월 16일출연: 송강호, 유아인, 문근영, 김해숙, 전혜진 외.관람등급: 12세이상 관람가 (뉴스컬처=) 대한민국 No.1 문화신문 [뉴스컬처] [네이버 뉴스스탠드]... ",sado
2015-09-03 20:33:00,newsculture,"‘사도’ 유아인, 정직한 슈트핏(NC포토)","[영화정보]영화명: ‘사도’장르: 사극감독: 이준익개봉일: 2015년 9월 16일출연: 송강호, 유아인, 문근영, 김해숙, 전혜진 외.관람등급: 12세이상 관람가 (뉴스컬처=) 대한민국 No.1 문화신문 [뉴스컬처] [네이버 뉴스스탠드]... ",sado
