user_name,rating,review_text,likes_count,replies_count,created_at,movie_id
함성규,3.0,"아마 <물의 연대기> 후기 막판쯤에 남겨놓은 것 같은데, 미래를 보는 능력까진 없어도 기대치가 '낮았다' 수준이 아니라 당연히 기대치가 '없었다'.

그만큼 나에게 있어 이 작품을 연출한 '사람'이, '감독'이라 지칭될 시절은 나조차 초등학생 시절에나 교실에서 선생님이 틀어주셨던 <라이터를 켜라>를 만들었을 때만큼이나 옛날이었고, 나는 그 작품을 어릴 적에도 그리고 성인이 되어서도 가끔 다시 볼 만큼 꽤 좋아했다. (대놓고 좋아한다고 표현하는 [차승원] 배우가 나오는 것도 있고, 무엇보다 지금은 하늘의 별이 되신 [남문철] 배우가 등장하는 후반부 찰나의 ""경찰청장~"" 씬의 개그를 정말 좋아하기 때문에.)

그 뒤로는 감독이라 불릴 만큼 딱히 이렇다 할 무언가를 남기지는 못한 것 같은데, 아마 지난 코로나 시즌쯤(마스크를 워낙 오래 쓰고 다녀서 [23년~24년 시절도] 코로나 시국이었는지 기억은 나지 않지만)부터 우연히 영화관에서 작품을 자주 접하게 되는 순간들이 많았다. 장편 2개와 단편 4조각 중 하나의 조각 정도.

그 작품들을 모두 관람한 관객 혹은 호구들이라면 이미 알겠지만, 사실상 감독이라 불릴 만한 그릇의 크기는 전혀 발견하지 못했다. 나도 전작에서 이미 표현했던 것 같은데, 이 사람은 감독이라는 호칭보다는 그냥 ""누구 남편"" 혹은 ""예능인""이라는 호칭이 더 잘 어울릴 만한 사람이었던 듯하니까. (위에 언급한 '단편에서조차' 가장 별로였던 기록이 장항준이었으니까.)

그 정도로 기대조차 하지 않았고, 그냥 명절 앞둔 이 시기에 상업 영화 [BIG 5 배급사] 중 하나인 쇼박스가 들고 왔다는 점에서부터 쇼박스 특유의 공작단 바이럴과 매해 그랬듯이 반복되는 '이 시기쯤' 충무로 공장에서 찍어내는 ""돈 벌려고 만든 영화""라는 것은 당연히 예상하고 있었다. 정말 웃기게도 '이 자리에, 이 시기에' 작품을 내걸 수 있는 위치에 [장항준]까지 왔다는 상황 자체가 지금 충무로의 위상이 어디까지 내려앉은 것인지 짐작해 볼 수 있는 부분.

그래서 이미 밑밥은 충분히 깔아둔 것 같고, 당연히 지금부터 써 내려갈 문장들은 예전에도 비슷하게 남겨본 적 있는 것 같은데 딱히 실망감이나 분노, 짜증 같은 감정이 섞인 결과물이 아니며 아마 다음 주에도 비슷한 느낌으로 후기를 남길 것 같아서 위에 적은 문장들을 그대로 복사해서 붙여넣기 해도 될 것 같지만... 아무튼 작품을 보는 동안에도 죽은 동태눈을 한 채 관람했고, 지금부터 적을 문장들 역시 예상했던 범위 내의 결과물에 대한 기록일 뿐이라 감정의 변화는 거의 존재하지 않는다.

나는 ""이래서 한국 영화가 어쩌고저쩌고~"", ""한국 영화를 왜 돈 주고 봐?""라고 떠드는 같잖은 🐦끼들과 달리 한국 영화에 대한 애정이 상당히 높은 사람이다. 상업 영화, 독립 & 예술 영화를 딱히 구분하지 않고, 대구에서 아예 개봉조차 안 하는 수준이 아닌 이상 웬만한 한국 영화는 굳이 찾아가서 일일이 다 챙겨 볼 정도로 애정도 남다를 만큼 영화 보는 것 자체를 좋아할 뿐만이 아니라, 특히 독립 영화 쪽은 '이번에는 또 얼마나 잘 만들었을까?' 믿고 본다고 할 만큼 자주 보는 편.

내 지인들은 물론이고, 영화와 관련된 정보원?으로서 내 계정을 팔로우하거나 구독하는 사람들도 알고 있겠지만 순수하게 나보다 완전히 마이너 계통에 있는 한국 영화까지 일일이 챙겨 봤다고 말할 수 있는 인간은 포스터 팔아먹는 업자 놈들 아니고서는 거의 없을 것 같다. 그리고 나는 그 영상 폐기물인 <에스퍼의 빛>조차 내 돈 주고 관람하고, 러닝타임에 맞먹을 정도로 이 작품이 어떠니 저떠니 일일이 기록을 남길 만큼 후기에 정성을 쏟아붓는 편이고.

그런 의미에서 나는 이렇게 대놓고 ""돈 벌려고 만든 영화""에는 꽤 강한 혐오감을 느끼는 편이다. 비단 이 작품에만 국한되는 이야기는 아니겠지만, 이런 뉘앙스의 문장을 적어온 지도 벌써 10년에 가깝다고 느껴질 정도이며, 이 작품에서 받은 인상이나 완성도, 연출 같은 부분들은 정말 붕어빵 기계 틀에서 찍어냈다고 해도 믿을 수 있을 만큼 창작자의 노력이나 영혼 같은 게 전혀 보이지 않았다.

시대와 소재만 조선시대 사극으로 설정해 두었을 뿐, 작품에 담긴 그림을 보면 현대를 배경으로 했든 과거를 배경으로 했든 간에 그 과정이나 배우들, 작품이 전달하려는 감정들 또한 2001년, 2006년, 2011년, 2016년, 2021년, 그리고 2026년까지 정말 단 하나도 차이가 느껴지지 않았다고 해도 될 정도였다. '이 작품만의 매력'이라고 칭할 수 있는 부분은 모든 요소들을 통틀어 단 하나밖에 없었던 것 같다.

나는 영화를 꽤 '많이 보는 사람' 중 한 명이니까 논외로 잡고, 굳이 한국 영화나 드라마를 자주 보는 관객이라면 이 작품의 고질적인 문제점이 처음부터 눈에 들어오겠지만, 늘 그랬듯이 출연하는 배우들이 매번 거기서 거기라는 점. 매번 이 시기쯤 되면 스크린에 얼굴을 비추는 [유해진]을 일단 주연으로 잡아두고, 조연이라는 양념 또한 [이준혁 1], [오달수]라는 뻔한 조합에서부터 살짝 답답함과 한숨이 나올 정도였다.

물론 나는 오달수가 나오든 육달수가 나오든 작품만 좋으면 상관없고(그 당시 평이 별로였던 걸로 기억하는데, 24년도 작품인 <오후 네시>도 나는 꽤 재미있게 봤다), 배우의 사생활 논란 같은 외부적인 잡음 역시 이 경우엔 그 당시 진실 여부를 함부로 확정 지을 수도 없다고 생각하는데다가, 아이러니하게 장항준의 작품에서 이런 이야기를 적는 게 조금 웃기긴 하지만, 소년범 출신이나 학폭 가해자 같은 '인간쓰레기' 부류가 아니라면 배우의 외부적인 잡음까지 크게 문제 삼지는 않는다.

아무튼 주연 배우 3명이 누구인지(유해진, 유지태, 내 마음속에 저장) 정도만 알고 있었지만, 유해진 X 이준혁 1 X 오달수라는 조합을 보면서 '와, 정말 지긋지긋하고 진부한 느낌이다'라는 생각과 함께 '여기에 [장이수] 한 명만 더 얹어놓으면 진짜 화룡점정이겠다'라고 생각하고 있었는데 거의 뒤이어 바로 [박지환] 배우가 등장하는 것을 보고 소름이 끼쳤을 정도였다.

이렇게 진부하고 지긋지긋한 뻔한 조합에 어설픈 꽁트와 40~60대 어르신이나 좋아할 올드한 개그를 시도하는 순간부터, 작품이 벌써 '낡고 후지다'는 생각이 들었고, 거기에 이런 지긋지긋한 조합과 더불어 감..독...은 아니고 장항준 본인 작품에 얼굴을 비췄거나 예능 프로그램과 관련된 인물들을 이리저리 배치해 두었다는 점. 주연인 유해진을 필두로 김수진, 장현성, 안재홍, 유해진 아들 역의 배우 등등... 여기서부터 안 그래도 진부한 조합인데도 불구하고 도대체 어디까지 보여줄 것인지 궁금할 지경으로 굉장한 기시감이 들 정도.

그런 점에서 작품의 시대 배경, 소재만 달라졌을 뿐 예나 지금이나 똑같은 한국 영화의 특유의 틀에서 벗어나지 못했는데, 본인과 인연이 닿은 배우들까지 총집합시켜 역할만 조금 바꾼 [마리오네트] 인형극을 보여주고 있다는 생각이 들기 시작했다. 그리고 내가 영화 후기를 남길 때 ""마리오네트""라는 표현을 쓴다면 그건 연출이나 배우들의 연기가 가장 밑바닥이자 최악에 가깝다는 뜻인데, 형식적인 연출이나 배우들의 기계적인 연기에서 감정이나 영혼 같은 건 1도 느껴지지 않았고, 그냥 돈 벌려고 만든 작품에 배우들 또한 연기가 아닌 '알바'하러 온 사람들 같았다.

이 정도까지가 작품 초반 정도인 30~40분 동안 느낀 생각과 감정들이었다. 사실 위에서는 ""감정 변화가 거의 없었다, 무덤덤한 동태눈으로 감상했다""라고 적었지만, 사실 아예 기대치가 없었음에도 예상치를 상회할 정도로 '가슴이 답답하다'는 생각까지 들었다. 작품에 등장하는 [큰 고양이 CG]라거나 장이수 역으로 유명한 [박지환] 배우에 대해서는 악감정은커녕 꽤 좋아하는 편임에도 불구하고, 이 작품에서만큼은 중반부 직전쯤의 특정 장면들이 연기가 조금 견디기 힘들었다. 이상한 디렉팅 때문인지, 쓸데없는 개그를 유발하려는 티키타카 씬 때문인지 몰라도 극장을 나가고 싶은 충동을 참기 어려웠을 정도.

작품의 느낌이 [이준익] 감독이 연출하는 정통적이면서도 무거운 감정과 여운이 남는 사극 영화가 아니라, 그냥 예능인 장항준이 본인의 예능 프로그램인 [꼬꼬무]의 한 에피소드를 실사화해 놓은 듯한 느낌이었다. 정작 나는 그 프로그램을 챙겨보지도 않고 한 편도 제대로 시청해 본 적이 없어서, 지나가다 인터넷에서 보거나 가족이 보고 있으면 밥 먹으며 가끔 쳐다보는 수준인데도 불구하고... 장항준 본인이 캐릭터에 빙의해서 스토리텔링을 하는 것처럼 들리는 캐릭터들의 대사 톤도 그렇고, 중간중간 시도하는 말 같지도 않은 개그 연출 때문인지 사극 영화로서의 무게감은 전혀 느껴지지 않았다. 그냥 [조선시대 사극 배경 / 흥행할 만한 역사적 소재 / 익숙한 유명 배우들 / 적당한 감동과 신파]를 섞어 ""한국 영화 한 편 만들어줘""라고 GPT에게 부탁해서 나온 결과물에 가깝다고 느껴졌다.

이 앞에 언급한 부분들도 정말 '최저, 최악'에 가까울 만큼 밑바닥 수준으로 여겨졌지만, 이 작품을 통틀어 가장 최악인 요소 하나를 꼽으라면 세 명의 주연 배우 중 한 명인 [유지태]의 캐릭터와 연기였다. 나는 유지태라는 사람을 얼마 전에도 비슷한 문장을 사용했던 것 같지만(권상우 & 차승원), 배우로서나 인간으로서나 한국의 남성 배우 중에서도 독보적인 느낌(<올드보이> 정도의 시절)과 위상을 가진 배우라고 생각했었다. 배우이기 이전에 사람으로서도(얼마 전 [사회복지] 관련 훈훈한 소식처럼) 굉장히 좋은 배우이자 선한 사람이라고 믿는 편이지만...

정말 아이러니하게도 이전에도 이상한 작품을 만나는 경우가 종종 있긴 했어도(<돈>, <꾼> 같은...), 이 작품에서는 정말 평면적인 빌런이자 캐릭터였고, 연기마저도 아무런 영혼과 깊이가 없다는 생각이 들 정도로 최악의 출연작이었던 것 같다. 웃자고 적는 소리가 아니라, 대나무 하나를 대신 세워두거나 다른 남자 배우 아무나 데려다가 대사를 시켰어도 될 만큼 굳이 이 작품에 유지태가 나와야 할 이유를 전혀 느끼지 못했다.

앞에서 말했던 [뻔한 조합 & 기시감, 진부함, 지겨움] [유해진]을 비롯한 주조연 배우들의 '기계적인 연기' 또한 유지태 배우 덕분에 차라리 좀 더 괜찮게 보였을 정도 수준이었다. [이준혁 1] 배우와 더불어 [이준혁 2] 배우까지 등장했기 때문에 좀 더 불안했었는데, 이 작품에서는 그나마 괜찮게 느꼈을 정도.

그냥 총체적으로 눈에 보이는 그림이 정말 조금도 새로움을 줄 수 없는 조합처럼 느껴졌다. 똑같은 말의 반복이지만 매번 이 시기에 보는 얼굴들, 충무로 상업 영화에서 맨날 보는 캐릭터와 맨날 똑같은 연기들뿐이었다. 작품에 걸려있는 감독 이름 하나만 다를 뿐이지, 만들어진 결과물에서 특별한 차이점을 느낀 적이 거의 전무하다고 해도 될 만큼.

차라리 며칠 전 관람했던 [권상우] 주연의 <하트맨>조차 앞에서 늘어놓은 문장들과 큰 차이점은 없겠지만, 적어도 보는 동안 황당하면서도 진실된 웃음이나 아역 배우의 정말 뛰어난 연기, 주연 배우들의 로맨스 조합에서 훈훈하고 풋풋한 감정이라도 느낄 수 있었다면... 이 작품은 언제부터인가 계속 사용하고 있는 표현대로, 당연히 돈 벌려고 만든 영화겠지만 배우와 감독이 작품에 열정과 영혼을 담았다는 느낌이 정말 1g도 느껴지지 않았다. 그냥 이 시기에 영화관에 내걸 수만 있으면 <좀비딸> 같은 작품에 출연하고 연출하는 사람들조차 돈방석에 앉을 수 있을 만큼, 아무 생각 없이 만들어진 충무로 공장형 무비 1223번째 정도.

그럼에도 불구하고 이 작품은 연출 시기상의 이점과 배급사의 전략(쿠폰, 무대인사, 특유의 바이럴 등등)에 의해 흥행할 것이고, 딱히 그런 흥행이 불쾌하다거나 막고 싶지 않은 이유는... 감독과 배우들이 진부한 것과는 별개로 나는 한국 영화가 꽤 잘되기를 바라는 사람 중 한 명인 데다가, 이 작품에서 유일하게 ""정말 좋았다""라고 칭할 수 있는 요소가 다른 모든 최악의 요소들을 상쇄시킬 만큼 괜찮았다.

정말 딱 하나, 세 명의 주연 배우 중 한 명인 [박지훈]이 보여준 캐릭터의 연기만큼은 예외였다. 이제는 '배우'라고 불러야 할 만큼 작품에서 정말 괜찮았던 요소 하나가 박지훈의 연기였다. 아직은 신인 배우라 칭해야 할 만큼 많은 작품을 만나보진 못했고(제대로 된 주연 영화 역시 이번이 두 번째에 불과하지만), 초반만 놓고 보면 마스크에서 비롯되는, 어찌 보면 꽤 수월해 보이는 캐릭터를 맡은 듯 보이기도 했지만...

그럼에도 작품 전반에 깔린 섬세한 감정의 톤, 그리고 대사를 처리하는 발성 같은 부분에서도 그렇고 아이돌 가수 출신이라는 편견이 전혀 느껴지지 않았을 만큼... 배우 한 명의 연기를 보기 위해 영화관에 올 만한 가치가 있다고 말해도 좋을 만큼, 박지훈이라는 배우의 연기 하나만큼은 상당히 좋았다.

마지막 클라이막스에서 보여주는 [유해진]의 연기조차 아무런 감정이 들지 않을 만큼 '뻔하다'는 생각이 들 정도였는데, 그런 유해진과 케미를 보여주는 주연 박지훈의 연기 덕분에 작품의 전체적인 평가나 별점은 높게 주지 못해도, 박지훈이라는 배우의 연기 하나만큼은 4.5점이나 5.0점을 줘도 아깝지 않을 만큼 훌륭했다. 물론 유지태의 기계적인 대나무 연기 톤과 장항준의 연출에서 대충 3~4점이 까인 셈이지만...

시대와 소재만 바뀌었을 뿐, 창작자의 영혼은 전혀 없이 기계적으로 찍어낸 충무로 김밥 영화 공장에서 찍어내는 전형적인 기시감을 다시 한번 마주했다는 점. [장항준]이라는 이름에 걸었던 기대치가 '제로'였기 때문에 더 실망할 것도 없었지만, 작품 전반에 깔린 연출 실력이 예상보다 더 가슴을 쿵쾅거리게 만들었다. (여러 가지 의미에서) 그리고 내로라하는 충무로의 이름 있는 배우들의 연기는 그런 기대치에서조차 더 밑바닥을 상회할 만큼 한숨이 나오게 만들었지만, 의외로 아이돌 출신이라는 편견을 완벽히 지워낸 박지훈이라는 배우의 연기 하나 때문에 평가와는 별개로 꽤 머릿속에 남는 작품으로 남게 될 듯.

'배우 한 명만' + [전미도] 배우와의 엔딩 장면까지.",26,0,2026-02-04T23:14:14+09:00,the_kings_garden
불란서개구리,3.0,굳이 ㅇㄷㅅ를 안 써도 됐을텐데,25,0,2026-02-14T21:55:11+09:00,the_kings_garden
sean park,3.0,"영화업계, 극장가가 초토화된 가운데 이게 천만?

두 바퀴로 가는 자동차, 네 바퀴로 가는 자전거,
물 속으로 나는 비행기, 하늘로 나는 돗단배,
복잡하고 아리송한 세상.
잘 생긴 남자, 아름다운 사람, 유해진, 유해진, 유해진.",21,0,2026-03-05T12:19:21+09:00,the_kings_garden
june,3.0,가뜩이나 못 만들었는데 오달수까지 나오는 영화,13,0,2026-02-11T23:26:01+09:00,the_kings_garden
이공사육,3.0,"단종 역이 강단있는 표현을 잘 소화해 의외였음.
장감독은 예능에서 세상 재밌으심. 영화는 안하셔도 될 듯.",12,1,2026-02-17T21:01:54+09:00,the_kings_garden
삼이이,3.0,"갑니다 ㅇㅈㄹ..
그리고 한명회 아이라인 진짜 표독해보이네염",6,0,2026-02-07T22:40:42+09:00,the_kings_garden
승조,3.0,연출 어이없어서 박장대소함 왜 난리인지 모르겠음,5,1,2026-03-04T00:50:27+09:00,the_kings_garden
권영헌,3.0,"배우들이 대사할 때 발음 실수도 들리고, 배우들의 대사와 컷전환이 묘하게 안맞는 부분도 느껴졌다. 초반 싸구려 개그는 진짜 개정색빨게 만들었고. 호랑이가 화살 맞고 절벽 떨어질 때 cg랑 연출이 너무 구려서 빵 터졌다 ㅋㅋ 마치 성냥팔이소녀의재림 보는 것 같았다. 제작비가 많지는 않은걸로 알고 있는데, 그렇다고 너무 대충 찍으셨나 싶다.. 감독님께서 촬영중에 컷은 3번을 넘지 않았다고 하는데 대사가 발음 씹히는 데 그걸 그냥 쓴 거는 조금..
천의 얼굴 유해진 배우가 무작정 억지로 악만 써대는 인물로만 디렉팅 된 것은 매우 아쉽다. 저렇게만 연기하는 배우가 아닐텐데... 영화 보는 내내 유해진 배우 특유의 매력적인 목소리가 듣기 싫었다. 감독의 인물 설정과 디렉팅이 얼마나 중요한지, 배우의 연기와 이미지에 얼마나 큰 영향을 끼치는지 잘 알 수 있었다.
배우를 알맞은 역할에 잘 캐스팅하는 것도 감독의 능력이라고 사람들이 칭찬을 많이 하던데, 반대로 다른게 너무 많이 부족해서 할 말이 없어서 그런 류의 칭찬만 많이 나오는 것 같다. ㅋㅋ

인간적으로는 너무 좋고 존경스러운 사람인 장항준 감독이지만, 좋기만 한 사람의 한계가 영화에 드러나지 않았나 싶다. 억지스러운 ‘노’와 ‘애’의 감정의 흐름이 영화 몰입을 깨더라.

집 가서 바로 진짜 거장의 영화 ”매트릭스“를 보고 눈 정화했다.",4,2,2026-03-05T03:51:14+09:00,the_kings_garden
Just2s,3.0,장항준 패고 싶다,4,1,2026-03-01T17:11:48+09:00,the_kings_garden
정민기,3.0,"관객을 얼마나 만만하게 보면 이런 영화를 내놓을까.
수십 년 전 클리셰와 성의 없는 미장센에 화가 난다.",4,0,2026-02-18T01:36:12+09:00,the_kings_garden
준서,3.0,별로 슬프지도 않았음,3,0,2026-03-04T20:18:56+09:00,the_kings_garden
이온유,3.0,"너무 오바를 많이 한다. 개그도 진짜 재미 없었는데 여기저기서 빵빵 터지는 걸 보니 신기했음. 호랑이 cg는 디워보다 못하더라... 제작비가 부족했나? 결말부 억지전개, 서사부족 신파는 견디기 힘들었다.",3,0,2026-03-02T01:15:41+09:00,the_kings_garden
박하미,3.0,"잘 빚어진 감동극의 토대에는 ‘이해’가 놓여 있다. 감정이 움직이려면 먼저 납득이 필요하다. 그리고 납득은 대개 체험의 결에서 비롯된다. 그래서 역사물을 볼 때면 자연스레 이런 질문이 떠오른다. 우리는 과연 누구의 자리에 서게 되는가. 왕인가, 백성인가. 십중팔구는 후자를 택한다. 권좌보다 생활이 더 익숙해서다.

<왕과 사는 남자>는 어린 군주가 민생 속으로 스며들며 변모하는 과정을 그린다. 설정만 보면 흥미롭다. 절대권력의 상징을 인간으로 환원하겠다는 시도니까. 다만 여기에는 전제가 필요하다. 관객이 그 인물을 ‘사람’으로 받아들일 준비가 되어 있어야 한다는 것. 문제는 그 준비 과정이 충분히 마련되지 않았다는 데 있다.

단종은 조선의 비극적 군주지만, 오늘날 대중에게는 교과서 귀퉁이의 이름에 가깝다. 나 역시 시험 대비용 정보 이상으로 알고 있지는 않다. 오히려 배우 박지훈이 더 친숙해 머릿속에서는 <프로듀스 101> 테마곡이 흐를 지경이었다. 스타의 기존 이미지가 캐릭터를 덮어버리는 순간, 극중 인물은 역사 속 군주가 아니라 동시대 아이돌로 인식된다. 감정적 거리감이 좁혀지지 않은 상태에서 절정이 도착하니, 눈물샘은 반응 대신 당혹을 택한다.

맥락이 충분히 축적되지 않으면 정서는 뿌리내리지 못한다. 그래서인지 노산군은 병약한 소년으로, 금성대군은 준비만 하다 막을 내린 인물로 남았다. 입체적 인물상 대신 인상적인 단면만 스쳐 지나간 셈이다. 결과적으로 기억에 또렷하게 남은 건 서사의 흐름이 아니라 배우 유해진의 존재감이다. 극을 끌어간 것이 인물의 선택이라기보다 연기력 자체처럼 느껴졌다면, 균형은 이미 한쪽으로 기울어 있는 것이다.

장항준 감독의 작품을 많이 접한 편은 아니지만, 이번 연출에서는 장면의 임팩트에 비해 정서적 축적이 얕다는 인상을 받았다. 사극은 특히 시간의 두께가 중요한 장르다. 인물의 내면이 차곡차곡 쌓여야 비극도 설득력을 얻는다. 만약 이러한 리듬을 고수한다면, 차라리 <30일>이나 <연애 빠진 로맨스>처럼 상황의 속도감이 중심이 되는 장르가 더 잘 어울리지 않을까 싶다. 무게보다 템포가 강점일 경우, 방향을 그쪽으로 잡는 편이 현명하다.

결국 감동은 명령으로 생성되지 않는다. 인물의 시간을 함께 견뎠을 때 비로소 따라오는 부산물이다. 충분히 동행하지 못한 채 맞이한 눈물은, 솔직히 말해 감격이라기보다 의아함에 가까웠다. 기대가 컸던 만큼 아쉬움도 진했다. 올해 들어 가장 값비싼 교훈을 얻은 셈이다.

다음에는 제 지갑과 심장을 동시에 설득해 주기를.",3,0,2026-02-25T18:19:06+09:00,the_kings_garden
네리찌푸,3.0,박지훈 연기랑 눈빛 말곤 볼게없네,3,0,2026-02-22T15:41:20+09:00,the_kings_garden
배감성,3.0,이 영화에서 진정한 한명회는 장항준이다.,3,0,2026-02-19T16:56:05+09:00,the_kings_garden
킹갓진인,3.0,"영화적인 리듬, 완급조절이 그냥 없는 수준.",3,1,2026-02-17T21:18:18+09:00,the_kings_garden
하피이글,0.5,소재는 흥미로웠으나 1시간이면 끝날 스토리를 질질 끌어서 1차원적인 감정선만 넣었으니 재밌을리가 있나. 류준열 배우의 연기력이 돋보인 작품.,6,0,2022-12-21T15:24:39+09:00,the_night_owl
제이,0.5,예상가능한 전개. 한국영화의 흔한 여배우 쓰임. 인조가 조 소용 뺨을 때릴 거라 생각은 했는데 실제로 보니 생각보다 불쾌했다. 무엇보다 그 장면에서 관객석에서 웃음이 터지는 것을 보고 오물을 뒤집어 쓴 기분.,6,0,2022-12-20T08:37:19+09:00,the_night_owl
하온이아빠,0.5,"억지스러운 전개, 연출에 답답함을 느꼈다. 주인공은 무슨 질문에 대답을 저리도 느릿느릿, 이 영화는 볼 영화가 별로 없는 시기에 개봉한 덕을 봤다.",4,0,2023-03-01T22:59:49+09:00,the_night_owl
양성진,0.5,너무 유치했다.. ㅜㅜ,3,0,2023-02-05T20:10:25+09:00,the_night_owl
멍멍코,0.5,주맹증...,2,0,2022-11-24T15:29:08+09:00,the_night_owl
조현우,0.5,원손 울 때 뭔가 빡침 뻔한 영화 초반에 잠깐 흥미진진하고 끝,0,1,2025-09-21T01:40:31+09:00,the_night_owl
ahnjaewoo,0.5,"장르적 정체성이 불분명하여 내러티브의 중심축이 흐릿하고, 일관된 분위기 조성에 실패한다. 다양한 장르 요소를 시도했으나 유기적으로 융합되지 못해 결과적으로 서사의 통일성과 몰입감이 떨어진다. 고증박살 개막장 드라마",0,0,2025-04-14T01:02:11+09:00,the_night_owl
이웃집박선생,0.5,‘침술사’ 아니다. 당시 엄연한 의원醫員이다. 호칭은 똑바로 하자. 이것 부터가 이 영화를 다 망쳤다. 그리고 철저히 망해 마땅하다.,0,0,2024-07-13T02:45:34+09:00,the_night_owl
하암,0.5,전개가 너무 느려,0,0,2024-02-10T20:35:09+09:00,the_night_owl
남도현,0.5,조선 데어데블 할많하않,0,0,2022-11-23T21:58:21+09:00,the_night_owl
Euntherthesea,1.0,후반부 개연성 무슨일... 아무리 픽션이고 아무리 영화라도 그럴싸하긴해야지,25,0,2022-11-26T22:56:03+09:00,the_night_owl
