user_name,rating,review_text,likes_count,replies_count,created_at,movie_id
에스,3.0,"현 한국의 불편한 상황들을 충분히 잘 반영했다는 것에는 반박할 수는 없다. 현실적이지 않으면서도 현실적인 사회 풍자적인 작품이다. 그러나 중간중간에 굳이 이렇게 연출했어야 했나 싶은 장면들이 많아서 보기에 힘들었다. 전혀 15세 같진 않았고, 오히려 19세로 방영을 했다면 관람객도 불편하지 않게 볼 수 있지 않았었을까 한다. 영화가 끝나고 여운이 많이 남지만 이 여운은 기분 좋게 계속 가져가고 싶은 여운이라기 보다는 심히 무겁고 괴로운, 머리가 저려오는, 그래서 얼른 떨쳐내고 싶은 여운이다. 보는 내내 상징적인 연출이 많이 보였기에 해석을 본다면 더 많은 것이 담겨 있구나를 알게될 수 있을 것 같다. 그러나 앞서 말한 것처럼 다시 생각하기엔 너무 무겁기에 별로 보고싶진 않다. 전형적인 한국영화스러움은 거의 없어 상당히 신선한 소재와 이야기 전개를 경험할 수 있다. 하지만 살면서 딱 한번정도는 볼만한, 딱 한번정도는 생각해볼만한 이야기이다. 절대 두번 다시 보고 싶지는 않다.",0,0,2022-04-03T00:04:59+09:00,parasite
원이,3.0,재밌다고 하도 말이 많아서 봤는데 제 취향은 아니었어요,0,0,2022-02-08T01:05:11+09:00,parasite
Yyyw,3.0,안 본 눈 유지할 걸,0,0,2022-02-01T22:31:35+09:00,parasite
Yoo,3.0,모두가 훌륭하다 했지만 나는 난잡했다,0,0,2021-07-26T12:26:44+09:00,parasite
감자전,3.0,전개는 흥미로웠지만 감정적 몰입은 되지 않았다,0,0,2021-07-06T01:40:47+09:00,parasite
아라구라구,3.0,나는 이 우울을 작품성으로 평가 할 깜냥이 안되나보다;,0,0,2021-06-28T02:15:14+09:00,parasite
한승,3.0,호들갑좀떨지마세요,0,0,2021-05-30T04:51:22+09:00,parasite
Laonhajeah,3.0,쫄보인 나한텐 너무 무섭고 잔인함. 보다보면 그냥 속이 디집어짐..,0,0,2021-05-10T15:27:47+09:00,parasite
새싹,3.0,과연 이해하고자 하는 생각이 있었던 걸까.,0,0,2020-08-12T02:44:37+09:00,parasite
Jiin Kim,3.0,난 잘모르겠다... 그냥 내 취향과는 거리가 먼 영화...,0,0,2020-07-15T08:27:50+09:00,parasite
shelter,3.0,"선(line, class)을 넘는 것에 대해 곱씹게 되는 영화.
ㅤ
2020.07.04",0,0,2020-07-04T21:13:41+09:00,parasite
쿼크,3.0,솔직히 내 스타일은 아녀,0,0,2019-12-27T15:04:18+09:00,parasite
두둥,3.0,"중반까진 재미, 후반으로 갈 수록 '이 장면을 왜 넣은 거야?'란 장면이 너무 나와서 불쾌하기만 하고 결론도 흐지부지 별로였음",0,0,2019-10-06T16:01:02+09:00,parasite
윤어진,3.0,"작위적, 억지. ""이 장면엔 이런 의미가 있어요? 어때요 놀랍죠?"" 노잼.",0,0,2019-10-06T01:45:47+09:00,parasite
정욱,3.0,ㅠㅠ,0,0,2019-06-10T22:25:47+09:00,parasite
___,3.0,"2019.05.30
올해 첫 극장 영화",0,0,2019-05-30T16:49:21+09:00,parasite
noam,4.0,"이야기의 구조와 미술은 뛰어나다. 하지만 이런 주제에 대한 이해도와 이야기의 울림은 <어느 가족>이나 <플로리다 프로젝트>보다 못하게 느껴진다. 더 우월해야 할 필요는 없지만 상을 받은 이유가 뭘까에 대해 생각하다보니 굳이 비교를 하게 된다. 
가난해서 좀비가 되기도 하고 바퀴벌레가 되기도 하고 싸우다가 인디안이 되어 백인같은 주인놈을 처단하기도 하는데 무리수 맥락도 무리수 대사도 많아 어색. 가난에 대한 봉준호식 오리엔탈리즘 이라고 할까.
그리고 대사도 상황도 설정도 클리셰가 많아서 독창적이라는 시각에도 공감하기 어렵다. 명절영화식 개그나 감성도 꽤 있는데 깐에서 상탔으니까 구리지 않다는 식으로 받아들이는 것은 납득이 가질 않는다.",60,10,2019-05-31T00:00:43+09:00,parasite
우히,4.0,굳이?를 외치게 만드는 남감독 특유의 성도착증,36,0,2019-06-01T23:44:19+09:00,parasite
이유진,4.0,"무기력하다...
내일이면 아둥바둥 지하철에 끼여 출근할 나...
영화 퀄리티와는 별개로 심신이 우울해지는 영화였다
두 시간 내내 1호선에 갇혀있던 느낌
_
봉감독 태어날 때부터 로얄패밀리인거로 아는데
그런 부르주아의 시선으로 가난을 그려서 더 암울하다
가난한 사람이 수능을 어떻게 4번 보고
미대 준비를 어떻게 하냐 ..?
곱씹어볼수록 영화계의 골든구스 같음
_
이 영화로 유럽 부르주아들의 전원 일치 동의를 받아 
보석이 반짝반짝 새겨진 트로피를 받았다는 것도 
참... 영화의 연장선상같은 블랙코미디",32,0,2019-06-03T00:13:04+09:00,parasite
김미미,4.0,가난을 혐오하는 것이 상류층의 박사장인지 상류층의 봉준호인지. 섹스어필은 멈출 생각을 안 하고 나레이션도 멈출 생각을 안 하고,32,1,2019-06-02T01:36:59+09:00,parasite
전연경,4.0,봉준호가 만든 '박찬욱 영화',28,1,2019-05-31T19:43:07+09:00,parasite
3days,4.0,"관람을 마치고 나서 기분이 매우 좋지 않은 영화다.
-
주인공 가족들을 더욱더 기생충으로 보이게 하기 위한 가난 포르노, 기도 안 차는 미성년자와의 되도 않는 로맨스(라고 표현하기도 역겨움), 15세 관람가와 맞지 않는 애무씬에 자극적인 피떡칠 칼부림과 뜬금없는 마무리. 남들은 좋게 봤을 지언정 나는 이 모든게 불편하고, 짜증나고, 영화관을 나올 때 몹시 우울해졌다.
-
상 받았다길래 정말 엄청 기대를 했었다. 그러나 연이어 터지는 과거 인터뷰들 재조명에 으악... 영화를 마저 보고 나오니 이제 더이상 봉 영화 볼 일 없을 것 같다. 어차피 내가 안 봐도 많은 사람들이 봐줄 테니까 타격감은 0이겠지만 내 멘탈은 건강하겠지... ㅡ190602",27,0,2019-06-02T14:26:13+09:00,parasite
파니핑크,4.0,가난이 오브제가 되었을 때.,23,0,2019-07-17T15:00:33+09:00,parasite
효니,4.0,"단 한 번도 가난해서 눈치받거나 냉대받거나 움츠러들거나 주눅들어본 적 없을 것 같은 사람이 만든 영화라는 게 '대단히 상징적이다'. 
부자들이 순진하게 속아넘어간다고?
그 부자들한테 피골이 상접하도록 등처먹히고 있는 숙주들 주제에 말이다.
이 와중에 입은 잠옷에서 나는 덜 마른 빨래냄새가 짜증나네.",23,0,2019-05-30T20:25:23+09:00,parasite
mone,4.0,"기분 좆같았다 노골적인 상징도 흐름도 과장된 연기도 별로고 어떤 성찰도 없는 불쾌함에 기성세대에서 잘나가던 사람이 잘 디벨롭해서 일군 영화가 바로 이거구나 싶었다. 그리고 송강호 짱싫음 연기도 싫고 얼굴만 봐도 불편하다.
조여정 연기가 좋았고 박소담도 멋졌다.
소소하게 기억에 남는 장면은 다혜가 기우를 거뜬히 업는 것과 너무 길고 재미없어서 의아한 종북개그. 다들 해석해석거리길래 종북개그 해석 찾아봤는데 그냥 다들 재밌다네요. 너무 구석구석 안 맞는 영화였다.",22,0,2019-06-01T23:46:16+09:00,parasite
해오름,4.0,"영화는 겁나 잘 만드셨습니다만,
머리가 제법 커버린 뒤의 저는
더이상 당신의 시각에 동의할 수 없네요..",20,0,2019-06-12T08:15:40+09:00,parasite
도비,4.0,"자본주의사회 속 빈부격차라..
뭘 의도한지는 알겠다만은 나와는 잘 안맞았다
숨겨진 의미가 따로있나 싶었는데 찾아보니 그마저도 내가 해석한 그대로라 크게 색다름을 찾을 수 없었고...
엔딩크레딧에 나오는 cj 부회장 이미경 이름 석자가  
되려 영화보다 더 영화 같은 극과 극의 대비를 아주 선명하게 보여줬다고 생각했다
불편함을 주기 위해 만든 영화를 보고 정말 불편해져서
하루종일 기분이 별로였다
보고난 후 든 생각
1. 몰입도는 좋다 근데 기분 나쁘다 불행포르노라는 생각을 떨칠 수가 없다
2. 계획 없이 사는 빈곤층을 그려놓고 어떻게 그렇게 바로 기생하기 위한 일자리 구하기라는 계획을 짠거지
3. 도덕성의 결여 그리고 그걸 인지 못하는 가족들, 
부자를 선망하고 우상화하는 모습, 무능력함, 자기합리화, 자격지심과 열등감 - 불편한요소가 다 들어가서 불편할 수밖에 없었다
가난해서 그렇게 된걸까 아니면 그렇기에 가난한걸까 생각하게 하는 것부터가 선을 넘을 듯 말 듯 했다
이러한 요소가 괜한 가난혐오로 이어질까 두려운 마음뿐
4. 상류층과 빈곤층에 씌운 스테레오타입이 지극히 클리셰덩어리였다 
부자들은 이래 가난한 사람들은 이래
근데 이거봐라 사실 부자들도 추악한면이 있다?
그걸 누가몰라.. 사람들 다 그렇잖아
5. 기괴하고 기괴하며 찝찝하고 또 찝찝하다
그리고 자꾸 생각난다",17,0,2019-06-02T01:35:56+09:00,parasite
딘딘,4.0,다른건 몰라도 미성년자랑 성인이 거의5살차이가 나는데... 미성년자가 먼저 꼬셔서 키스하는 장면은 제가 영화를 잘 모르는 것도 있지만 굉장히 그렇네요....여러모로 충격적인 영화;,15,0,2019-06-03T00:11:22+09:00,parasite
yay,4.0,"기생충이니 바퀴벌레니 비유당하고 기분 좋은 사람이 있을까? 정말 ‘기생충’(실제 기생충처럼 살지도 않는다 영화에서는)의 삶을 살고 있는 사람이 이 영화를 본다면? ‘기생충’들은 이런 영화도 못보러 올 거라고 생각이라도 하는 건가? 사람에 대한 기본적 예의가 안녕하다면 감히 갖다붙일 수 있는 ‘상징’인가? 단순한 상징이 아니라 무려 이 영화의 제목이자 감독의 관점이 담긴 단어이다
-
재작년 황금종려상 <더 스퀘어>와 궤를 같이 해서 소름이 끼쳤다 막말로 재수없는 계몽(하려 드는)영화다 미쟝센이 너무 아깝다
-
바퀴벌레가 정말 기생충인가 검색해봤는데 오히려 바퀴벌레에 기생한 생물만 20만 종이 넘는다고 한다 그리고 질긴 생명력은 말할 것도 없다 바퀴벌레는 그 질긴 생명력으로 오래오래 살아남아 마침내 그 무엇의 숙주도 아닌 본연의 삶을 살아갈 것이다
(‘상징적으로’ 선택한 바퀴벌레 착즙하려니까 힘들다)",14,0,2019-06-03T00:25:27+09:00,parasite
이홍주,4.0,"봉준호 인터뷰, 그리고 좋은 영화라는 여론에 휘둘려 모른척 넘어갔던 많은 불편한 장면들이 계속 생각이나 썼던 코멘트도 지우고 별점도 깎음",14,2,2019-06-01T00:22:17+09:00,parasite
영화나보자,4.0,"가난을 묘사하는 방식이 지나치게 도식적이다. 와이파이도 없어서 옆집 와이파이 빌려쓸 정도로 가난한데 4수를 어떻게 준비하고 미대 입시를 어떻게 준비해..? 책상에 앉아서 가만히 공부만 하는것도 다 돈이고 더군다나 미대 입시.. 아이쿠ㅠ 저 정도 소득수준 가족이면 대학은 꿈도 못꾸고 어디든 바로 취직하는게 현실인데ㅠ 대한민국 사는 사람이라면 절대 저 소득수준에 대학을 4수나 준비하고 미대 입시를 준비한다는게 절대 불가능하다는걸 누구나 아는데 왜 봉준호만 모를까..? 차라리 그 어린애들 둘이서 어떻게해서든 먹고살겠다고 고등학교 졸업하자마자 바로 취업해서 일하는 장면이 나왔다면 훨씬 현실감있고 공감갔었겠다..
그리고ㅠ 반지하 사는 사람들이 비가 억수같이 내리면 당연히 자기 집 걱정부터 해야 하는 게 당연한거 아닌가? 비 쏟아지는거 생각도 안하고 탱자탱자 놀다가 캠핑갔던 이선균네 가족이 돌아오고나서야 집 가봤더니 반지하 집이 잠겨있더라,, 이 상황에서 송강호 가족한테 안타까움을 느낄 수가 있음? 난 답답하고 한심하던데. 사지 멀쩡한데 노가다라도 뛰어서 어떻게든 해볼 생각을 해야지 네 명이 진짜 신기하게도 집에 가만히 둘러앉아 가난을 타개해볼 어떤 노력도 안한다. 아 피자박스는 한번 접는구나 근데 그 간단한 것마저 제대로 못하고(못했다기보단 제대로 신경써서 안했지 피자박스 접는데 뭐 그렇게 정교한 기술이 필요하다고,,) 난장판 만들어놓고ㅋㅋㅋㅋ 송강호네 가족을 동정할 여지가 하나도 보이지 않는다. 오히려 회사에서 일 열심히 해서 돈 열심히 벌고 자식들 사랑해서 자식들한테 좋은거 뭐 하나라도 더 해주고 싶어하는 이선균 조여정이 불쌍함. 이선균 조여정이 잘못한 거라곤 사람 믿은 잘못밖에 없음,,
아 이 영화의 주제가 사람 함부로 믿지 말자면 인정. 그렇다면 주제를 완벽히 전달한 최고의 영화다",13,2,2019-06-27T18:27:51+09:00,parasite
휴이,4.0,어쩌란 것인가 그래서.,13,0,2019-05-30T22:49:34+09:00,parasite
mj,1.0,언론 시사회 후기. 스토리가 부족하고 많이 지루함. 감독의 연출 스타일도 올드해 보임. 문근영은 스며들지 못하고 겉도는 느낌. 흥행은 힘들것 같음,97,2,2015-09-05T20:54:41+09:00,sado
강수영,1.0,"욕심 때문에 버리지 못한 장면, 장면들이 하이라이트 부분을 갉아 먹은 느낌, 어떤 장면도 살리지 못한 느낌이다. 배우, 감독 모두 기대하고 본 영화여서 더 아쉬웠다.",60,1,2015-09-17T09:51:09+09:00,sado
백새롬,1.0,2.5점정도로 죽 가다가 엔딩에서 다까먹고 0점 주겠다. 나의 정신건강을 위해 이 감독의 영화는 앞으로 멀리하는걸로.,25,0,2015-09-17T08:08:59+09:00,sado
Jane Baek,1.0,지루하기 짝이 없다가 마지막 소간지님 등장하사 요다님 앞에서 장기자랑 하신다고 할 때 랩하시면 어쩌나하고 오열.,11,0,2015-09-21T08:08:49+09:00,sado
홍지혜,1.0,너무 과했다는 생각이 든다 ㅠㅜ... 초반부터 분장 때문에 영화의 첫 인상이 안 좋아져서 그런가? 뭔가 자꾸 핀트가 어긋나는 느낌이 들었다,10,0,2015-09-21T11:19:25+09:00,sado
영화보러 가는길,1.0,이기적이고 치졸한 행동들을 실망감으로 포장하는 비정한 아비의 장엄한 서사시.,8,0,2015-09-29T07:47:23+09:00,sado
브랜든 - 냉정한 평가자,1.0,드라마보다 못함,6,0,2015-11-05T04:37:55+09:00,sado
윤정,1.0,"돈주고 보긴 아까웠음
진지한 내용에 허술한 특수분장 중간에 웃었다
역시나 유아인 연기는 느끼하다..",6,0,2015-09-23T04:49:20+09:00,sado
박재승,1.0,"흥행은 흥행일뿐이고 재미와는 전혀 상관없는 것을 증명해준 영화다.
한마디로 해서 그냥 재미가 없다. 제발 흥행과 작품성을 연결시키는 마케팅좀 하지 말자.",5,0,2015-11-09T07:05:18+09:00,sado
자유의영화,1.0,되도 않는 조악함의 극치. 연기자들의 연기가 어디서 갖다 붙인 구성 속에서 낭비됨.,5,0,2015-09-23T10:53:27+09:00,sado
이승철,1.0,"보는내내 지루해서 혼났다. 흥미를 끄는 요소도 하나도 없었다. 마지막 정조 즉위에 ""과인은 사도세자의 아들이다.""가 나왔으면 임팩트라도 있었을걸;드라마라론 몰라도 영화소재론난별로",4,0,2015-09-20T22:36:34+09:00,sado
유상현,1.0,추석때 가족들이랑 볼 영화는 아니다. 부자간의 갈등을 유발할지도...,3,0,2015-09-22T03:25:09+09:00,sado
ike,1.0,영화는 재미있는데 영조 개빡쳐서 0.5점 드립니다.,2,0,2025-05-08T09:16:36+09:00,sado
ㅁㅁ이,1.0,"미국에선 독립혁명이 일어나고 중국에선 수백개의 은행이 성업하던 그 동시대에 조선에선 예, 덕 운운하며 가족드라마찍고있었구나...",2,0,2020-02-04T05:36:59+09:00,sado
모두까기인형,1.0,다이아 수저로 태어나 애비를 죽이려하다 오히려 애비한테 역관광당한  천하의 불효자식에 대한 이야기,2,0,2016-12-01T19:17:25+09:00,sado
kminu,1.0,더러운 영화,2,0,2016-04-15T23:40:53+09:00,sado
곽대영,1.0,"지루함의 끝
내용도 진부함
오로지 볼 건 배우들의 연기력",2,0,2015-09-29T22:54:22+09:00,sado
Jeongtaek Lim,1.0,"노인 분장술을 보여주는 영화네요. 연기력이 커버한다고 위로해 보지만, 도저히 위로가 되지 않는다. 전혀 기대하지 않고 봐도 실망되는 영화다",2,0,2015-09-29T10:53:59+09:00,sado
우울한cut과 유쾌한song,1.0,여자-어머니의 생일은 축하받아야한다.,2,0,2015-09-24T07:02:08+09:00,sado
사오일,1.0,더럽게 지루하네,1,0,2020-08-13T13:48:35+09:00,sado
이달수,1.0,"두번째 보았다.
처음에는 사도세자가 인간적 고뇌에 힘들어, 지금으로 보면 정신이 혼미해졌다는 내용으로 인식했지만 두번째 보니 그것이 아니라는 사실이 보인다.
비록 그 세력을 전면에 세운 것은 아니지만, 병권을 장악하고 있는 세력으로부터 외면 당하고 있음을 보았다. 
왕권국가에서 병권이 왕이 아닌  다른 세력에게 있다는 것은 이미 왕권국가라 하기 힘들다. 병권이 없는 왕을 왕이라 할 것인가? 이미 허수아비로 전락한 왕이 무엇을 할수 있을지 순종,헌종, 철종에서 볼 수 있다.
예전에 보았던 '사도세자가 꿈 꾼 나라'를 책장에서 다시 꺼내는 씁쓸함이 입가에서 가시지 않는다.",1,0,2018-11-18T18:24:13+09:00,sado
정다운,1.0,별로....,1,0,2015-10-24T12:15:51+09:00,sado
원선문,1.0,아진짜별로.핵핵노잼.ㅎ영사사고도났다.환불도안해줬다.아오빡쳐,1,0,2015-10-11T03:47:00+09:00,sado
Leeko,1.0,최악....,1,0,2015-10-05T03:29:04+09:00,sado
ㅇㅇ,1.0,그냥 아들 공부하기 싫어서 땡깡부리는 영화였습니당,1,0,2015-09-28T23:21:44+09:00,sado
박남준,1.0,그냥 둘 다 답답,1,0,2015-09-23T06:28:12+09:00,sado
맛탐,1.0,영조미화,0,0,2025-09-19T02:32:25+09:00,sado
Floyd Kim,1.0,조선시대에도 빛이나는 유아인의 라미네이트,0,0,2024-10-14T15:41:47+09:00,sado
래빗공주,1.0,넘잔잉함,0,0,2022-01-27T14:59:37+09:00,sado
믕슷믕,1.0,배우 우려먹기...  노잼.....,0,0,2022-01-06T05:49:25+09:00,sado
김영주,2.0,"연기력으로 채울 수 없었던 이해할 수 없는 주인공 들의 감정선. 왜 자식을 버려야 하는지, 왜 사도가 죽어야 하는지를 이해하기에는 너무나 부족하다.",254,38,2015-09-17T01:57:41+09:00,sado
Seong-Yeon Kim,2.0,도대체 왜 평이 좋지? 쓰레기였음. 역사 날조에 개연성 제로에 그지 같은 연출; 심지어 영화 몰입 강제 파괴시키는 특수분장; 이준익은 픽션사극만 하는걸로; 정조 아역이 그나마 살림,9,0,2015-09-19T10:17:15+09:00,sado
이주연,2.0,"'제 아비의 마음을 보았습니다'
철저히 왕이었던 영조, 아비의 따뜻한 눈빛 한 번이 너무나도 간절했던 아들, 그리고 끝까지 외면당한 아버지의 마음을 보듬어준 또 한 명의 아들.",7,0,2015-09-22T08:08:16+09:00,sado
박정현,2.0,영화보러갔다가 딱딱한 국사수업들은느낌..,7,0,2015-09-19T07:21:15+09:00,sado
박해완,2.0,단체로 보고 호불호가 극명했던 영화. 돈 주고 볼 영화는 아님.,7,0,2015-09-17T22:46:12+09:00,sado
머로리,2.0,부모자식 관계를 사도세자로 풀어낸 흥미로운 착상을 받쳐주지 못한 고루한 연출,6,0,2015-10-31T05:28:38+09:00,sado
이재철,2.0,소지섭이 제대로 놀아보겠다고 했을 때 랩하는 줄 알았네,6,0,2015-09-26T02:56:04+09:00,sado
임지혜,2.0,"가정교육 잘못해놓고 정치탓하는 아버지....설득력이 떨어지는 조잡한 스토리라인, 특히 분장 학예회인줄......",6,0,2015-09-23T07:21:00+09:00,sado
한원석,2.0,이 영화를 보고 돈이 아까워져서 영화관에서 집까지 버스를 못 타고 걸어왔습니다. 전체적으로 운명의 엇갈림이란 주제를 다루는 방식이 산만했는데 마지막 소지섭 부분은 산만함의 종지부.,6,1,2015-09-17T01:11:03+09:00,sado
박평식,2.0,여기서부터스포주의:사도 죽음,3,2,2025-02-10T04:02:40+09:00,sado
베지터,2.0,어디서 끝맺을줄 알아야할터,3,0,2015-12-17T03:09:08+09:00,sado
최성영,2.0,이제 이준익꺼는 안볼라구..,3,0,2015-10-05T00:32:56+09:00,sado
유녘,2.0,"부정확한 발음때문에 자막이 필요할 정도의 남극일기때의 송강호를 보았고
이 영화를 기점으로 비로소 세대교체가 되는 시점이라 생각이 들어 기분이 오묘했다",3,0,2015-09-18T11:47:58+09:00,sado
Cineman,2.0,유아인 오바에 메세지가 묻히다보니 관객석이 뒤주속이되었다.,2,0,2016-06-15T11:41:46+09:00,sado
나아님,2.0,영화관을 나가고 싶은 나의 마음이 뒤주에 갇힌 사도 세자의 마음과 같겠구나 생각하니. 감독님 천재.,2,0,2016-01-01T22:39:33+09:00,sado
술의요정,2.0,미스캐스팅 그 이전에 연출력의 부재. 지루한데 길기까지 해,2,0,2015-12-21T17:44:56+09:00,sado
윤영주,2.0,너무 지루하고 재미없었음. 배우들 연기는 잘함,2,0,2015-10-29T00:52:22+09:00,sado
unknown,2.0,부전자전 맞고만 뭘ㅡㅡ,2,0,2015-10-01T18:12:04+09:00,sado
백훈,2.0,독립다큐수준. 배우가 안간힘을다해빈자리를 메꿀려하지만 역부족. 송강호의 연기력과 마케팅의 힘. 재미없음.,2,0,2015-09-29T19:24:53+09:00,sado
다죽여,2.0,영조 사도 정조 그 누구에게도 감정이입이 안됨. 시종일관 울어제끼기만 하는 영화..,2,0,2015-09-29T08:59:22+09:00,sado
Young KIM,2.0,지루함의 끝판왕,2,0,2015-09-29T06:50:33+09:00,sado
애니똥,2.0,"도무지 행동의 이유가 이해되지 않아 캐릭터들이 전부 보기 불편함.
또 늙은 분장을 꼭 써야만 하는 그런 씬들이 필요한 영화였나 싶음. 특히 마지막 15분. 
전체적으로 끔찍한 영화. 내가 역사를 배우면서 만났던 슬픈 인생의 사도세자를 되게 불편한 사람으로 만들어줌.",1,0,2019-03-05T04:41:28+09:00,sado
김혁명,2.0,두 유명배우가 만들어 낸 희안한 영화,1,0,2019-02-17T02:34:23+09:00,sado
이한재,2.0,조선왕조는 승정원과 실록의 밀착기재로 충분히 개인적이고 미시적이며 드라마틱한 서술 또는 해석이 가능하다. 그런데 왜 부자간의 가족 갈등 스테레오타입을 굳이 왕과 왕자 사이의 특수한 관계에 어거지로 쑤셔넣었을까? 미시역사와 구조해체에 대한 좌파적 집착과 몽니가 만들어낸 어처구니없는 시나리오가 만들어낸 해프닝인가?,1,0,2018-12-12T23:14:49+09:00,sado
S Kwag,2.0,"-노인 분장을 그모양으로 해야만 했나?
-아버지와 아들이 어찌나 똑같은지 
-가운데 끼인 식구들은 뭔죄인가?",1,0,2018-12-08T19:15:53+09:00,sado
정준호,2.0,오버액션 유아인,1,0,2018-04-29T01:34:47+09:00,sado
멍멍코,2.0,괜히 길다,1,0,2017-08-06T10:42:19+09:00,sado
Sangdae Hyun,2.0,사극이 아닌 POV,1,0,2017-01-19T22:31:34+09:00,sado
SJ,2.0,"지나치다.
많은 말들이 작품을 헤집었다.",1,0,2016-12-18T03:01:19+09:00,sado
yangmo,2.0,문근영의 할머니 분장이 어색했음.,1,0,2016-09-17T12:49:43+09:00,sado
j0408,2.0,재미없어,1,0,2015-10-03T08:58:55+09:00,sado
김민수,2.0,지루하다 못해 찌질하다,1,0,2015-10-03T06:19:08+09:00,sado
이병욱,2.0,몰입을 방해하는 invisible something...,1,0,2015-09-29T12:14:15+09:00,sado
소귀에 경 읽기,2.0,부자유별,1,0,2015-09-19T12:12:05+09:00,sado
이윤우,2.0,얼마나 허리 아팠을까,0,0,2026-02-10T05:15:12+09:00,sado
성호,2.0,한국 사극 영화를 기피하게 된 이유.,0,0,2024-01-23T01:21:40+09:00,sado
지은,2.0,"1. 회사선배가 영화계 일하는 친구가 사도 재밌다고 재밌어서 일부로 개봉일도 추석쯤으로 미뤘다는 말에 기대했는데 핵노잼. 그나마 회사 조강으로 봐서 다행이었지 내 돈 주고 봤으면 돈과 시간 후회 많이 했을 것 같다. 제일 고조되었을 때 졸았으니 말 다했다.
2. 유아인의 연기는 좋았지만 영조를 굳이 송강호를 썼어야 했나 라는 의문이 들 정도로 크게 임팩트 없다. 전체적인 스토리도 그렇고. 문근영도 얼굴 아끼지 않고 하는건 좋은데 이런데서 아끼지말지. 얼굴 안아끼는 좋은예=그녀는예뻤다의 믿보황.
3. 애초에 영조를 너무 나쁘게 그렸고 사도를 너무 당한자로 그렸고 정조도 너무.. 너무 편협한 시각으로 미화된 영화였다.
4. 아차. 최민철 배우 나와서 깜짝. 비쥬얼도 목소리도 짱짱!
5. 정조 아역배우 귀엽고 똘망똘망. 그래서 첫씬에서 몰입이 확 되서 이 영화 좋을줄 알았다.. 꼬마가 아비를 살려달라고 아비가 못한거 소자가 하겠다고 하는데 아이고😢",0,0,2022-08-21T22:18:19+09:00,sado
要尝试才能知道成功不成功,2.0,지루해도 너무 지루하다,0,0,2022-04-10T16:15:16+09:00,sado
우주먼지,3.0,한국 영화 천만 관객 컴플렉스에 영화는 사라지고 엔터테이먼트만 남았다. 차라리 사약을 주세요.,13,0,2015-09-30T09:12:09+09:00,sado
용구이,3.0,"산만하고 뒤죽박죽
소지섭은 왜 나왔나",13,0,2015-09-18T08:30:44+09:00,sado
김예지,3.0,왕의 남자 이후로 이준익은 끝난 것 같다,11,0,2015-09-17T19:30:24+09:00,sado
전이빈,3.0,쏏,6,0,2015-09-19T09:37:55+09:00,sado
