user_name,rating,review_text,likes_count,replies_count,created_at,movie_id
이장원,1.0,지루행,0,0,2020-01-26T00:46:59+09:00,the_man_standing_next
박재현,1.0,아무런 내용이 없다  다 아는 내용,0,0,2020-01-25T20:02:40+09:00,the_man_standing_next
TK Lee,1.5,혁명같은 소리하고 있네.  그나물에 그밥인 놈들이 그때 다 말아먹었으면서.  영화로 만들던지 다큐로 만들던지 노선을 좀 정하지.,32,0,2020-01-22T22:18:17+09:00,the_man_standing_next
이장수,1.5,총알 한 발로 획득되는 혁명의 가치는 어디서 찾아야 하나,9,0,2020-01-22T23:01:06+09:00,the_man_standing_next
소다미,1.5,‘너 하고 싶은 대로 다 해’란 말이 ‘난 아무거나’ 다음으로 세상에서 제일 무섭다 . . 200128 논아맥,4,0,2020-01-30T04:35:48+09:00,the_man_standing_next
Susie Jeong,1.5,이걸 이렇게 지루하게 풀어내다니,4,0,2020-01-23T17:37:41+09:00,the_man_standing_next
롯데폐인,1.5,"일부 영화관에서는 박통 총 맞는 장면에서 박수도 나왔다는데, 김재규가 대통의 꿈이 정말 없었을까? 일국의 대통을 저렇게 격하시켜 연출한 이유는 뭘까? 그래서 얻는게 뭘까? 감독의 생각은 과연 뭘까? 본인이 맞고 다 안다고 자부할 수 있나?",3,0,2020-02-22T16:14:37+09:00,the_man_standing_next
알리바바,1.5,데보라 심 예쁘다. 이병현 멋있다 이외에는 다 엉성함. 마케터들의 광고에 휘둘리지 말자. 감독 주변에 차지절같은 인간들만 있는지 점점 영화가 엉성하다.,2,0,2020-01-31T14:33:45+09:00,the_man_standing_next
강호,1.5,-유명해서 모두가 알 거라고 생각해서 그런지 몰라도 사건을 자세하게 얘기해주지 않아서 누가 불리하고 유리한지 대충 느낌으로 봐야함 -사건은 다 아는 거라서 인물에 포커스를 하긴 했는데 그 인물의 감정선을 못 느끼겠어 연기문제라기보다는 개연성의 문제인듯 -이병헌이 왜 그렇게 빨리는지 모르겠다. 연기도 그닥이고 외모도 그닥인데 -왜 죽였을까에 대한 애매한 대답 -남산으로 갔으면 전두환은 없었을까 -경쟁작들이 너무 형편없어서 돋보인 영화 -실제사건에 기반이라는 단점을 배우와 그들의 연기로 커버하려고 했는데...글쎄...? -쿠데타를 민주주의를 위한 혁명이었다고 정당화해버리기~~!!!,2,0,2020-01-29T21:48:38+09:00,the_man_standing_next
이종훈,1.5,역사관련 영화는  쓸데없이 평점이 높음. 개인적으로 이성민 곽도원 연기 질린다. 이병헌 때문에 봤는데 앞으론 신중해야겠음. 재미없음.,2,0,2020-01-27T00:29:09+09:00,the_man_standing_next
NN,1.5,온전한 다큐도 되지 못하는 것을 봐야 할 이유가 있나? 22.2.19,1,0,2020-03-01T16:29:20+09:00,the_man_standing_next
김준형,1.5,이럴 거면 다큐멘터리를 본다.,1,0,2020-02-23T00:42:48+09:00,the_man_standing_next
태경태세문단세,1.5,이제는 감독에게 과하게 느껴지는 배우들 그들에 가려진 스토리  월화 드라마 수준의 연출,1,0,2020-02-18T08:53:58+09:00,the_man_standing_next
민 주,1.5,영화적 허용으로 만든 뻔한 정치극과 미친 연기력,1,0,2020-02-05T04:17:04+09:00,the_man_standing_next
이준억,1.5,주제가 없는 영화,1,0,2020-01-31T12:49:50+09:00,the_man_standing_next
하늘과 바람과 별과 시,1.5,왜 조폭영화같지?,1,0,2020-01-30T20:10:18+09:00,the_man_standing_next
이도은,1.5,배신으로 인한 찐덕후의 탈덕이 이렇게 무서운 것이다. 연출이 너무나도 촌스럽고 평면적이라 몇번이나 잘 뻔. 1. 배우들 연기력 2. 토착 왜구들 발작 버튼 눌려서 부들부들 거리는 소재 3. 박정희 총 맞아 죽는 꼴 보는게 속 시원함 이거 세 가지만 볼 만 했는데 왜 나만 빼고 평이 좋을까.,1,0,2020-01-29T21:56:23+09:00,the_man_standing_next
노지선,1.5,어쩌라구..,1,1,2020-01-27T18:37:33+09:00,the_man_standing_next
지은,1.5,졸라 똑같아서 제목 모르고 봤으면 본 영환 줄 알았겠다구?,1,0,2020-01-27T18:23:51+09:00,the_man_standing_next
조미진,1.5,감독은 뭘 했는가...  각본이 안 좋으니 이병헌 연기도 볼품 없네. 블랙코미디도 아니고 뭐가 뭔지.  대한민국 대표적인 역사적인 사건을 꽁트처럼 그려놓았음. 캐릭터도 하나도 안 살고 뭘 보고 나온 건지 모르겠다. 박정희를 암살하고 나오면서 김규평(영화 상 김재규 이름)은 왜 자빠지는 거죠? 실패한 비틀기인가요...:(,1,0,2020-01-27T18:09:05+09:00,the_man_standing_next
박은결,1.5,흠.....^^ 굳이 영화화 해야했을까,1,0,2020-01-25T05:03:20+09:00,the_man_standing_next
융융222,1.5,노잼,1,0,2020-01-23T22:53:21+09:00,the_man_standing_next
김선재,1.5,사회생활 영화,0,0,2025-12-27T14:35:35+09:00,the_man_standing_next
ಠ益ಠ,1.5,중언부언. 김규평의 실각 과정은 충분히 알았으니까 그만 얘기해도 된다구. 이걸 보고나니까 임상수의 <그때 그사람들>이 얼마나 잘 만든 영화인지 새삼 느낀다.,0,0,2024-03-01T11:40:18+09:00,the_man_standing_next
이라이자,1.5,바삭바삭하다,0,0,2023-12-28T20:13:59+09:00,the_man_standing_next
Bbp,1.5,왜… 보이는 것만 잘 따라하면 고증을 잘했다고 하는 걸까? 그런 작품을 보면 짜증이 난다.,0,0,2023-08-28T04:52:11+09:00,the_man_standing_next
비니,1.5,어려워..어두워..재미 없어..,0,0,2022-09-29T09:25:41+09:00,the_man_standing_next
장현우,1.5,드라마 제5공화국이 훨씬 낫다,0,0,2022-05-28T22:34:26+09:00,the_man_standing_next
인생이마시멜로,1.5,"예상대로 흘러갔지만, 연기가 일품이야",0,0,2021-09-30T20:42:07+09:00,the_man_standing_next
영화를 말하자,1.5,보다껐다,0,0,2021-05-16T22:15:44+09:00,the_man_standing_next
별곡이,1.5,죄송해요 불면증이던 제가 딥슬립을,0,0,2021-01-22T23:04:50+09:00,the_man_standing_next
Yunmin Park,1.5,너무 잔잔했다고 해야하나?! 긴장감부족!,0,0,2020-12-17T08:38:42+09:00,the_man_standing_next
JiYongPark,1.5,최소한의 양심을 지닌 친쿠데타 간부가 최소한 인간으로써의 끝을 맺고 종지부를 찍었다.,0,0,2020-07-07T22:08:19+09:00,the_man_standing_next
ㅎㅅㅎ,1.5,한국 영화에서는 대사 한 마디씩은 남겨야 한다는 공식이라도 있는 걸까?,0,0,2020-05-05T23:01:01+09:00,the_man_standing_next
korea2096,1.5,암살사건 부분만 빼면 재미도 없고 의미도 없는 지루한 전개가 전부다. 그나마 볼만했던 건 신들린 듯한 박통 연기. 너무 똑같아서 처음뿐만 아니라 나올 때마다 깜짝깜짝 놀라게 한다.,0,0,2020-04-30T16:01:22+09:00,the_man_standing_next
천용희,1.5,"왜 이 원작을 가져다 이렇게 만들었는지 자체를 이해하기 힘든 영화. 우민호의 욕심 말고 아무 것도 남지 않은, 망한 영화 그 자체가 된다.",0,0,2020-04-29T17:25:59+09:00,the_man_standing_next
장성현,1.5,중정부장이 멋있는 놈이었네..,0,0,2020-03-28T14:45:14+09:00,the_man_standing_next
샤히,1.5,시대에 편승한뒤 배우들의 연기에 의지하는 구멍난 스토리,0,0,2020-03-03T22:22:34+09:00,the_man_standing_next
소귀에 경 읽기,1.5,병헌이형이 못하는것도 있다,0,0,2020-02-22T02:13:46+09:00,the_man_standing_next
BONG K,1.5,건조하다 못해 말라비틀어진 장작,0,0,2020-02-20T20:50:10+09:00,the_man_standing_next
태선,1.5,오락성 제로,0,0,2020-02-05T17:27:21+09:00,the_man_standing_next
젬쓰,1.5,사짜 - 천호 CGV,0,0,2020-02-03T18:49:50+09:00,the_man_standing_next
손유림,1.5,이상과 혁명  그리고 독재의 딜레마,0,0,2020-02-01T14:34:37+09:00,the_man_standing_next
anthonic,1.5,크레딧이 나올 때 더 이상 “가콰!” 소리를 안들어도 됨에 기뻐했다. - CGV 신촌아트레온,0,0,2020-02-01T11:49:31+09:00,the_man_standing_next
Jellybbinn,1.5,"저 시대의 패션을 연출하는 연출력이 돋보였고, 영화 색감이 좋았다. 다만 내용은 흥미롭지 못했다.",0,0,2020-02-01T01:58:19+09:00,the_man_standing_next
nonameeee,1.5,으윽;;;;;재미없어;;;;;; 하나같이 화만내는 등장인물들 보기가 버겁다,0,0,2020-01-30T16:00:22+09:00,the_man_standing_next
윤연,1.5,"알탕알탕이병헌 그럼에도 불구하고 이 영화를 본 이유는 흥행이 못 마땅한 사람들이 있어서, 탕탕절을 영상으로 보고싶어서.",0,0,2020-01-27T22:59:08+09:00,the_man_standing_next
dizzy,1.5,그냥 이씨가 연기를 잘한다...? 루즈함,0,0,2020-01-25T14:18:27+09:00,the_man_standing_next
도철,1.5,두번 볼 만한 영화는 아님 내부자들은 뽀록이었음  그때 그 사람들이 훨씬 재미있었음.,0,0,2020-01-25T02:29:29+09:00,the_man_standing_next
임정균,1.5,"유명 배우들이 등장하는 다큐같은 다큐. 그런데 현실보다 재미없는 전개, 긴장없는 연출.",0,0,2020-01-23T21:07:25+09:00,the_man_standing_next
Jaewook Kim ,1.5,파블로 라라인의 전기영화를 떠올리게 하는 연출. 그러나 다루고 있는 인물에 대한 확신이 부족해 보인다.,0,0,2020-01-22T19:06:39+09:00,the_man_standing_next
헤실,2.0,영화적 허용이라는 미꾸라지 같은 말로 빠져나갈 거였으면 마지막 육성은 넣지 말았어야지. 김재규 영웅전 잘 봤습니다.,124,13,2020-01-25T19:02:34+09:00,the_man_standing_next
sean park,2.0,계획의 중요성,44,0,2020-04-05T15:08:26+09:00,the_man_standing_next
johnpaulmacqueen,2.0,솔직히 마약왕이 실력이면 이건 누가 와도 못살린다. 최소한 감독 고집을 꺽을 편집자가 없으면 필 to the 망. 내가 꼭 개봉날 달려가서 보고 싶네.,39,6,2019-01-25T21:37:18+09:00,the_man_standing_next
무민,2.0,재미없어,30,8,2020-02-03T01:48:49+09:00,the_man_standing_next
이공사육,2.0,"남자는 인정받기위해 태어났다. 시기와 질투가 여자만의 것은 아니다. 모든 조직의 배신은 인정받지 못한 것에서 비롯된다. . 영화 속 마지막 최후진술 음성에서 그는 민주주의라는 대의를 위한 것이었다 했고, 본 영화는 그 가설과 신문 연재시리즈를 기반으로 만들었다. (김재규의 거사동기에 대한 평가는 여러 견해가 있으니 차치하고) . 이병헌 역은 권력으로부터 소외되는 과정, 1인자의 눈 밖에 나 막다른 길에 다다른 남자를 적절히 묘사한다. 마치 '달콤한 인생' 같다. 달콤한 인생에서도 남산의 부장들에서도 인정욕구를 채워주지 못한 대상을 향해 총을 겨눴다.",23,0,2020-05-03T14:04:06+09:00,the_man_standing_next
권정우,2.0,"이쯤되면 나는 그냥 우민호 감독이랑 안맞나보다.  . . . 이 감독 작품들은  배우들이 다 좋아하는 배우들만 나와서 전부 봤지만, 좋았던 작품이 단 하나도 없으며, 심지어 이번작은 보다가 잘뻔했다. 흥미로운 이야기를 다루고 있음에도, 작품이 다루는 사건이 어디에 집중해야될지 러닝 타임 내내 갈팡질팡하는 듯 하다. 아니 후반부 클라이막스 10분만 인상적인걸 보니 거기만 집중했나보다. . 보면서 묘하게 공작이 떠올랐는데, 공작이 100배는 잘만든 영화같다.",20,1,2020-01-24T18:10:20+09:00,the_man_standing_next
박선영,2.0,너무 지루해서 중간에 나가고 싶었다..,11,0,2020-01-22T22:22:05+09:00,the_man_standing_next
Ki-doo Kyung,2.0,그때 그사람들 보고 가세요.,11,5,2019-12-28T08:41:40+09:00,the_man_standing_next
박기진,2.0,시간순으로 구구절절 설명하다가 모두가 아는대로  결말. 굉장히 도발적으로 살인장면을 묘사한거 빼면 그냥 다큐를 봤지.,9,0,2020-01-22T11:46:37+09:00,the_man_standing_next
No name,2.0,"이희준의 오바하는 연기가 아수웠다 김재규를, 516을 포장하는 듯한 뉘앙스도 단, 김소진 님은 너무 아름다웠다",7,0,2022-03-04T18:26:49+09:00,the_man_standing_next
세리,2.0,장면장면의 연결이 뚝뚝 끊어지는 느낌 모두가 아는 이야기라고 해서 플롯의 허술함을 관객이 눈치로 때려맞추길 바라는것은 너무 무책임한 감독이 아닌가,7,0,2020-05-15T13:23:20+09:00,the_man_standing_next
박의진,2.0,그냥 뭐 그러쿠나.... 딱히 아무것도 없었다,6,0,2020-01-23T05:45:16+09:00,the_man_standing_next
가람동,2.0,"우민호 감독이 이슈되기 전까지의 영화는 보지않고 그가 대중에게 이름을 알린 세 편의 영화를 본 한 사람의 평범한 영화관객으로서 <우민호>감독이라는 이름의 신뢰도는  내게 그리 크지 않다. 그의 영화는 전반적으로  서스펜스가 부족하고 플롯은 단순하다 못해 사건의 나열에 지나지 않고 그렇기때문에 영화들이 필요이상으로 길다(참고로 본인은 영화의 미학은 두시간 반쯤되는 게 진정 즐길 수 있는 영화라는 아집을 가지고 있다)    그럼에도 불구하고 우민호라는 감독에게 <감독>이라는 타이틀을 아끼고 싶지 않은 건 적어도 이 나라에서 무늬만 감독인 여러 뜨내기는 절대 가질 수 없는 감독만의 색깔과 뚝심, 영화만이 가질 수 있는 영화적 그림을 그리려고 애쓰고 고민한 흔적이 보이기 때문이다. 대중에게 크게 기억되는 꼬추샷이라든지, 마약왕의 후반부의 고독들이 그런 예다.     그런 사람이 이번에 우리 현대사에서 가장 큰 사건 중 하나인 <1026사건>을 소재로 영화를 만들었다 한다. 괜찮은 원작이 있다면 충분히 자기재능을 살릴 수 있는 몇 안되는 감독이라는 기대감에 영화를 관람했다.  그리고 결과는...    전 작품의 부진한 흥행때문일까. 그는 너무도 소심하게 혹은 안일하게 이 사건을 다뤘다 생각한다. 그래서일까. 극장을 나오고나서 곧장 영화에 대한 이야기를 나누려는데 제목부터 기억이 나지 않는 것이다. 그만큼 개성이 약했고 영화로써 미학. 즉 <이것이 왜 영화가 되어야했는가>에 대한 기본 개념이 많이 희석되어있다.  당장 옛날의 썰전이나 강적들, 혹은 이 사건을 조명하는 토론이나 다큐멘터리에 비해 이 작품만이 가지는 <특색>이란 것은 무엇일까. 썰전의 1시간 반보다 이 영화가 더 그것을 깊이 다루었는가. 또는 재밌었는가... 라면 글쎄.    물론 초기 컨셉의 아이디어가 나쁜 건 아니다. 정치적인 시선(과연 홍보대로 정치적으로 중립을 지켰는가 혹은 왜 정치적이면 안 되는가에 대한 질문과는 별개로) 왜을 떠나 한 인간의 시선으로 이 사건을 바라본다는 컨셉. 그 한 줄 로그라인만 보더라도 얼마나 복잡하고 다채로운 인간군상이 상상되겠나.     그러나 이번 작품에서 우민호는 그 어느 것 하나 제대로 하지 못한 것 같다. 적어도 무엇을 주장해야겠다는 주제와 뚝심은 없다고 봐도 무방하다.   말하고자하는 것이 있다면 ""김재규 만만세""인데... 고작 그걸 말하고자 거대자본을 투입해 이 민감한 사회적 사건을 다룬다고?     뭐가 되었든 분명 창작자 나름의 시선으로 작품은 관찰해야 나는 창작자로서 쪽팔리지 않는다 생각한다. 하지만 우민호는 소심했고 누군가의 눈치를 봤으며 그로인해 <우민호>라는 브랜드 값어치 역시 실추시켰다 생각한다.    예고편에서도 나왔던 ""각하. 정치를 좀 대국적으로 하십시오.""라는 대사가 허공의 메아리마냥 들렸다. 개봉한 지 이십년이 지난 <그때 그사람들>에도 훨씬 못 미치는 그 허망한 창작자의 시선을 가지고 <대국>을 논한다는 아이러니가 마치 김재규의 마지막 오판과도 같아보였다. 그의 영화가 다시 극장에 걸릴 수는 있을지 없을지 모르겠지만, 어쨌든 한명의 관객으로서 한 창작자에 대한 기대는 앞으로 없을 것으로 보인다.    + 어찌되었든 이 영화의 하이라이트는 그 날의 그 시간인데... 정작 1시간 반동안 괜한 것에 시간을 허비하고 그 중요한 시간은 마치 영상을 스킵한 것마냥 살이 없다. 그 시간동안 얼마나 복잡한 동선과 인물관계가 있었는데... 그것들을 어영부영 날려먹었을까? 이해되지 않는 구성이다. 차라리 마약왕 말고 이 영화가 두시간 반을 잡고 꾸준히 갔어야하는 영화아니었을까?    + 아쉬운 부분으로는 전두환의 활용이다. 전두환이라는 캐릭터 자체가 독특한 인간인데 그의 캐릭터성을 일부라도 사용하지 않는다. 그것이 전반적으라 영화에 선택과 집중에 방해되서라는 혹시의 의견은 핑계라 생각든다. (왜냐면 현대사에도 영화에서도 그는 중요한 역할 중 하나이기때문)    그의 등장으로인해 내 개인적으로 보고싶었던 건 전두환이 박정희의 옆에서 얼마나 알랑방귀 뀌며 재미나게 권투중계를 하였을까. 얼마나 개 노릇을 하며 권력에 붙었을까가 궁금했는데 그런 요소들이 전혀 묘사되지않은 게 특히 아쉬움이 많이 남는다.  + 내 양옆앞뒤로 체감상 1/3이 졸았고 누군가는 코골이까지 했음. 꽤 신선한 극장체험이었음",6,1,2020-01-22T19:41:32+09:00,the_man_standing_next
iopuop,2.0,매우 지루했다 이미 알고있는 이야기를 표피적으로 보여줄 뿐..중반이후까지 이어지는 박부장 이야기가 특히 지루했는데 이미 다 아는 결말에 아무리 타악기를 두들겨대봐야 긴장감은 전혀 생기지 않는다 이병헌배우의 한 두 씬은 좋았지만 대부분 배우들이 역할놀이 하는 것 처럼 느껴졌고 미장센은 수준이하,6,0,2020-01-22T15:05:01+09:00,the_man_standing_next
쿠이나시,2.0,연기는 좋았으나 소품이 아쉽다.,5,0,2020-01-22T12:27:17+09:00,the_man_standing_next
오현석,2.0,글쎄다.,4,0,2022-12-05T23:27:06+09:00,the_man_standing_next
wickedlips,2.0,그래서 이 영화 왜 만들었다고?,4,0,2020-01-26T19:52:01+09:00,the_man_standing_next
권샤방,2.0,이미 기승전결을 모르는 사람들이면 모를까 아는사람들에게는 팩트를 설명하는건 대단한 반전이나 놀랄만한 기교라도 써서 영화를 재미있게 해야한다고 봄  교과서 보는줄~~ ㅜㅜ,4,0,2020-01-26T06:51:21+09:00,the_man_standing_next
예매완료,2.0,시간 있으면 <그때 그사람들>을 한 번 더 보는 게..,4,0,2020-01-23T02:07:00+09:00,the_man_standing_next
이의현,2.0,"별다른 숙고와 성찰이 없는 답습의 향연. 특히, 연기.",3,0,2020-05-31T08:56:54+09:00,the_man_standing_next
Jay Park,2.0,연기들은 잘한다마는  그래도 영화가 이마이 재미가 없어도되나 싶다,3,0,2020-02-05T21:55:03+09:00,the_man_standing_next
찹찹,2.0,이 영화를 왜 만든건지 모르겠다. 재연드라마 이상의 의의가 있을까?,3,0,2020-01-27T20:48:30+09:00,the_man_standing_next
다운펌,2.0,인물들의 정리가 필요하고  뭔가 구성이 난잡하다 . 인물의 감정선에 초점을 좀 더 맞췄으면 어땠을까 싶다,3,0,2020-01-27T00:17:32+09:00,the_man_standing_next
고독요정,2.0,"초중반이 너무 느슨하다. 그리고 개인적인 이유 때문에 그 행동을 한 것처럼 서사를 풀어갔다. 영화적 촘촘함이 떨어지고, 무엇을 전달하고자 했는지 모르겠다. 서사는 이상한 방향으로 풀어가고 마지막 검은 화면의 글자만으로 모든 것을 해결하는 듯한 느낌을 지우기 어렵다.",3,0,2020-01-26T23:15:36+09:00,the_man_standing_next
Gozetto,2.0,실화와 인물의 격랑 속에서 길을 잃다(2.0),3,0,2020-01-25T23:10:55+09:00,the_man_standing_next
신동헌,2.0,뻔한 재현극일뿐..,3,0,2020-01-25T23:03:39+09:00,the_man_standing_next
Taylor Lee,2.0,혁명가와 선동가 사이의 아슬아슬한 줄타기 (캐스팅에만 몰려 아쉬운영화),2,0,2020-03-07T16:12:47+09:00,the_man_standing_next
봉제필통,2.0,나는 그냥 현대정치극이 싫어 이런 식이라면 더더욱!,2,0,2020-02-08T01:19:44+09:00,the_man_standing_next
inni,2.0,이게 서프라이즈 재연 드라마와 다를것이 무엇인가. 이런 정치극에서 감독은 영화를 통해 메세지를 확실히 던져야 한다. 하지만 놀랍게도 이 감독은 이도저도 아닌 서프라이즈를 선택하면서 관객에게 물음표만 줬다. 이 별은 열연을 펼친 배우들의 연기를 위한 것.,2,0,2020-01-26T16:51:29+09:00,the_man_standing_next
겸윤,2.0,알~~탕탕!,2,0,2020-01-26T05:59:37+09:00,the_man_standing_next
박광수,2.0,예고편에서 느껴지는 긴박감이 전혀 느껴지지 않앗고 그냥 영화가 아무것도 없이 흘러갔다. 언제 각하가 총에 맞는지만 기다리면서 봤던 영화...,2,0,2020-01-23T17:48:56+09:00,the_man_standing_next
종이,2.0,어르신들에게. 어르신들 시대라고 신나서 말 얹으시던데 순간 제가 영화를 보는지 설민석 토크쇼를 보는지 헷갈렸읍니다. 내 앞과 옆에서 벌어지는 생생한 역사 재연 쑈쑈쑈! 그래도 제가 이해해야죠... 저 시대에 뭔 에티켓 교육이 있었겠어........ ㅎㅏ....,2,3,2020-01-23T13:18:28+09:00,the_man_standing_next
김헌,2.0,병헌이형이 7년이상 개처럼 일하면 누구든 죽어요,2,0,2020-01-22T23:05:29+09:00,the_man_standing_next
심다애,2.0,보는 내내 중국의 궁중암투물이 떠올랐다.,2,0,2020-01-22T22:18:42+09:00,the_man_standing_next
윤상훈,2.0,"그 시절을 겪었더라면, 영화가 조금 더 재미있었을까.",2,0,2020-01-22T22:17:10+09:00,the_man_standing_next
마니아#,2.0,주연배우들이 이 배우들이 아니었다면 ? 그래도 볼만했을까,1,0,2021-09-25T00:45:47+09:00,the_man_standing_next
이현준,2.0,이미 인물들의 설정은 시작부터 갈 방향이 정해져 있다. 이성민 배우의 연기는 어째 그 중에서도 붕 뜨는 느낌이다. 더 건조하고 묵직한 느낌을 주면 어땠을까. 본인은 시작부터 끝까지 악역의 연기를 하고 있었다. 오히려 의도적으로 건조하게 만들어진 연출에 찬물을 끼얹는 느낌 이었다. 나머지 캐릭터들의 단순함은 결국 이병헌의 내적 갈등을 풍부하게 보조하지 못한다.  정치느와르 물에서 가면 갈 수록 사극같은 전개가 되가는 것 같았다. 훌륭한 조명이 아깝다.,1,0,2021-02-26T17:55:52+09:00,the_man_standing_next
channy,2.0,실력에 비해 과한 패기를 갖고 있던 감독에게 그것마저 사라졌다. 연기밖에 볼 게 없는 점은 여전하다.,1,0,2020-10-23T16:31:01+09:00,the_man_standing_next
DS,2.0,이병헌 연기에 1점 추가함,1,0,2020-05-01T01:48:55+09:00,the_man_standing_next
한기태,2.0,참 재미없게도 얘기한다,1,1,2020-04-25T01:29:58+09:00,the_man_standing_next
조광원,2.0,스토리는 뭘까? 배우들의 연기만 좋았다.,1,0,2020-03-28T18:25:31+09:00,the_man_standing_next
구름,2.0,탕탕! 탕!,1,0,2020-02-27T21:54:39+09:00,the_man_standing_next
뿜뿜,2.0,배우들의 연기에 비해 내용이 부실하다. 긴장감은 있으나 너무 중구난방으로 튄다.,1,0,2020-02-25T15:24:26+09:00,the_man_standing_next
공포아님안봄,2.0,확실한 미스캐스팅. 실화인 '척' 하는 픽션. 배역에 안 어울리는데 연기만 잘한다고 다는 아니지?,1,0,2020-02-22T21:46:36+09:00,the_man_standing_next
젊은영혼,2.0,그날의 현장검증은 잘 했다. 차지철역은 미스캐스팅..실화의 장점을 못살리고 집중이 안되게 만든다,1,0,2020-02-22T00:02:51+09:00,the_man_standing_next
강지희,2.0,팝콘이 맛있었다,1,0,2020-02-10T11:52:14+09:00,the_man_standing_next
치국평천하,2.0,시대가 변하겠어 ? 이름만 바뀌겠지,1,0,2020-02-07T15:12:14+09:00,the_man_standing_next
조국장,2.0,직장 내 따돌림이 이래서 무섭다,1,0,2020-01-30T20:25:09+09:00,the_man_standing_next
강쥐,2.0,그때 그사람들이 너무 높은 벽이었던걸까 ...  왜 또 이걸 만들려고 한거지?  흥행 타이밍이라고 생각해서??,1,0,2020-01-28T23:58:53+09:00,the_man_standing_next
Inhoo  Ham,2.0,남산의 졸개들. 폼만 잡고 알맹이는 없다.,1,0,2020-01-28T19:56:33+09:00,the_man_standing_next
LSG,2.0,"연출의 포인트가 모호하고 일단 극중 대사가 잘 안들리는 씬이 너무 많다. 배우의 전달력, 발성 문제가 아니라 영화 음향 문제인 것 같이 느껴질정도. 그리고 교차편집하는 긴장감이 의도대로 되지 않는 것 같음. 우민호 감독의 연이은 실패. 김재규의 내면은 사명감, 혁명대의의 변질에 대한 것으로만 비춰지나 그것은 대의일 뿐, 그의 욕망이 투영된 지점은 하나도 보이지 않는다. 차지철, 박정희에 대한 묘사도 스테레오 타입 그대로 가져다 놓은 것은 실망스러움.",1,0,2020-01-28T15:54:35+09:00,the_man_standing_next
황유미,2.0,하...,1,0,2020-01-27T18:18:44+09:00,the_man_standing_next
히히,2.0,그냥 정치 영화는 나랑 잘 안 맞는 걸로,1,0,2020-01-26T23:30:37+09:00,the_man_standing_next
김김,2.0,지루했다. 영화보다 더 영화같은 실화스토리에 연기잘하는 배우들이 모였으니 좀 더 극적인 연출을 보여주고 더 멋있는 영화를 만들 수 있었을텐데. 아쉬움이 크게 남았다.,1,0,2020-01-26T22:56:38+09:00,the_man_standing_next
